Title,Price,Link,Image URL,Description,Reviews
"Samsung Galaxy Tab A9+ 27.94 cm (11.0 inch) Display, RAM 8 GB, ROM 128 GB Expandable, Wi-Fi Tablet, Graphite","19,999",https://www.amazon.in/sspa/click?ie=UTF8&spc=MTo4MTczMTY5NTM1MjE5MTc0OjE3MTkxNzI2NDI6c3BfYXRmOjMwMDEyMDI1NzEyMjczMjo6MDo6&url=%2FSamsung-Galaxy-Tab-A9-Expandable%2Fdp%2FB0CJ38X1BQ%2Fref%3Dsr_1_1_sspa%3Fcrid%3D3EKUOWI4I0TPH%26dib%3DeyJ2IjoiMSJ9.o-__6ZPnzwQBCpeW31p0A88dFFwjOTuEWsjkvT8sExsb9SE10-HCqRW_5ZP97t9pd-DQuqufTp86X7HPM7EesiD7F-yJ8BmlSgs6qHjx_CVIe1MPWTMu8tOzNuQ9gWuNtYNdM80nLqvsgEyD2z1Sb2ydbFVy5ucKe9n10eKNo49A4bm-VlTztKze8e8pjXHD-wVRZi1yijEPEkgRSaC49IUj48IpOAKaU6UdQ8m4ShQ.dZj-QkTlFM-wBbsmfydfaeeaXNOvIZOLzC1scVItAI4%26dib_tag%3Dse%26keywords%3Dandroid%2Btablet%26qid%3D1719172642%26sprefix%3Dandroid%2Btablet%252Caps%252C251%26sr%3D8-1-spons%26sp_csd%3Dd2lkZ2V0TmFtZT1zcF9hdGY%26psc%3D1,https://m.media-amazon.com/images/I/61afkty1foL._SY450_.jpg,"Outstanding vividness with 27.94 cm (11.0 ) LCD display, 90 Hz Refresh Rate, 1920 x 1200 (WQXGA); Qualcomm Snapdragon SM6375 Processor; 8 MP AF Rear Camera, 5 MP FF Front camera,Quad Speakers Surround Sound; 7040 mAh Battery; Memory Storage Capacity: 128.0GB; Ram Memory Installed Size: 8.0GB; Battery Capacity: 7040.0 mAH; Special Features: Fast Charging","Like the A9 plus wify tab verymuch !
Great 11 inch display, i did not feel any lag ever during my office activities of reading pdf, powerpoint, seeing videos and mp4. I do not do gaming.
Lound ,crystal clear sound with spatial distinction, supports dolby .
Has bluetooth and also headphone jack.
Side slot for microSD card upto 1 TB. My wify model does not support sim.
Those who have bought wify+sim suppport, the side slot supports microSD card and sim.
Usual Samsung One UI ...very convenient and easy to switch contacts, sms, downloads etc. Also logging in and setting up the tab using my another samsung phone was super easy and headache free. Also the Quallcom Snapdragon processor is reliable and heavy duty proof.
Dislike...
The main camera in rear is mediocre. Compared to such great device, configuration and display support ,this camera is just plain ordinary without much features.; This is awesome tablet. Very fast and battery life is good too. Highly satisfied with the purchase. I got this on offer for less than 13k in May 24.; Pros:
8 gb Ram..nice speed no lags..
No heating issue even when playing or charging.
Good big sound.
Good resolution..1080 p youtube videos
Good for reading..eyeshield..feature..screen size is big enough for a book page to fit comfirtably..this is what I wanted..
Con:
Battery is drying up even when I am reading only..in one day..every night I need to charge..my previous tab ..samsung 2 gb used to afford me more battery..but given 8gb speed its understandable..
If your requirement is only reading..better go with s6 lite 4 gb which also comes with pencil. But you want some multimedia n games too..then in this price range this one is best with 8gb RAM.
I am a happy customer. 5 out of 5 stars.; 1)First of all the seal was broken.
2) I found glues are shown between screen and body on all sides of the tab,which looks like a repaired one.
3)Month and Year in the box is showing March 2024 but I found so many screen shots in image folder, whose created date is showing Nov 2023.
4)There is no temporary screen guard on the screen as new phones or tabs usually have.; I got this at a very low price of 14k so it is a value for money amazing speaker quality good screen size for this price point; Has most of the features required in the latest technology tablet. Sufficient speed, memory and picture quality.; Overall tablet is nice ...but if you are using it more than 3.5 hours...then pls dont but it.; i had bought in february and now in june no issues. Tab works smoothly ,only battery drains out quickly even if not using it so have to charge frequently."
"Samsung Galaxy Tab A9+ 27.94 cm (11.0 inch) Display, RAM 8 GB, ROM 128 GB Expandable, Wi-Fi Tablet, Silver","19,999",https://www.amazon.in/sspa/click?ie=UTF8&spc=MTo4MTczMTY5NTM1MjE5MTc0OjE3MTkxNzI2NDI6c3BfYXRmOjMwMDEyMDE5NDgzODMzMjo6MDo6&url=%2FSamsung-Galaxy-Tab-A9-Expandable%2Fdp%2FB0CJ393D6H%2Fref%3Dsr_1_2_sspa%3Fcrid%3D3EKUOWI4I0TPH%26dib%3DeyJ2IjoiMSJ9.o-__6ZPnzwQBCpeW31p0A88dFFwjOTuEWsjkvT8sExsb9SE10-HCqRW_5ZP97t9pd-DQuqufTp86X7HPM7EesiD7F-yJ8BmlSgs6qHjx_CVIe1MPWTMu8tOzNuQ9gWuNtYNdM80nLqvsgEyD2z1Sb2ydbFVy5ucKe9n10eKNo49A4bm-VlTztKze8e8pjXHD-wVRZi1yijEPEkgRSaC49IUj48IpOAKaU6UdQ8m4ShQ.dZj-QkTlFM-wBbsmfydfaeeaXNOvIZOLzC1scVItAI4%26dib_tag%3Dse%26keywords%3Dandroid%2Btablet%26qid%3D1719172642%26sprefix%3Dandroid%2Btablet%252Caps%252C251%26sr%3D8-2-spons%26sp_csd%3Dd2lkZ2V0TmFtZT1zcF9hdGY%26psc%3D1,https://m.media-amazon.com/images/I/6100f2qmEnL._SY450_.jpg,"Outstanding vividness with 27.94 cm (11.0 ) LCD display, 90 Hz Refresh Rate, 1920 x 1200 (WQXGA); Qualcomm Snapdragon SM6375 Processor; 8 MP AF Rear Camera, 5 MP FF Front camera,Quad Speakers Surround Sound; 7040 mAh Battery; Ram Memory Installed Size: 8.0GB; Memory Storage Capacity: 128.0GB; Battery Capacity: 7040.0 mAH; Special Features: Fast Charging","Samsung galaxy tab A9 plus is very good product, also value for money.; The product meets expectations. Display is good with no extreme stress on eyes. Touch screen is soft to touch. Processor is good and works effectively with speed. I am satisfied with the product.; ; 5g Tab in most affordable price..After buying update the OS,then only touch pen will work properly.; Thy provided me an used product with touch response defect ...and next day refused to exchange rather suggested to go to service center ..... now i am thinking about consumer court; The battery life is extremely poor, draining quickly. I barely had enough time to watch a few YouTube videos and half of a movie on Netflix. Without even using it much the next day, the battery is completely drained, and by evening it's only at 20 percent. The thumb unlocking doesn't work well, and the facial recognition is terrible. Most of the time, you have to type in your password. I can't comprehend why people are so enthusiastic about this product.; Good battery backup good
Display; All of it is perfect...not for heavy gaming; This tablet is only for Arabic regions! My Country/region Is not in it. I will return this tablet and get one that has country choices..... I AM CHANGING MY REVIEW! I FIGURED IT OUT!
I was about to return it when I decided to give it another try! Luckily,
I was able to set it up easily! This tablet is wonderful! Clear picture, very thin and light weight. I am very happy with this tablet and I recommend it. 5 ✨️✨️✨️✨️✨️; Cette tablette ne fonctionne pas au Canada. J’ai parlé à un technicien de Samsung qui m’a dit de contacter Amazon. Incapable de parler à quelqu’un chez Amazon!; Very Happy With It; If you're looking to play casually. Sure. But if you're looking to play professionally or top-tier. Nope. It runs the game just fine, but the screen jitters when you move your camera. It makes precise aiming incredibly impossible sometimes the swiping is fast and sometimes it's slow, it has to do with how the screen registers where your finger is.

And if you play with a six-finger cloth or so many fingers on the screen that this doesn't even know how to sense your fingers.

If you're only looking for performance then this is good, but if you're looking to improve and accurately shoot at people, I can't recommend this.

My previous device was the Apple iPad Pro 2020 11-in and I played professionally on that.

The screen jitteriness on this one makes it almost impossible to be consistently accurate when shooting at people.; Purchased for my wife and she loves everything about it. Nice clear display, great sound quality, and quite a snappy performer. We have had several android tablets but always go back to Samsung. Connects easily to the internet and mobile hotspot from her phone so she can watch her tv shows anywhere. She is very happy and so am I, very happy with this purchase and would recommend to anyone."
"HONOR Pad X8 25.65 cm (10.1 inch) FHD Display, 3GB RAM, 32GB Storage, Mediatek MT8786, Android 12, Tuv Certified Eye Protection, Up to 14 Hours Battery WiFi Tablet, Blue Hour","8,999",https://www.amazon.in/Honor-Display-Mediatek-Certified-Protection/dp/B0BTDW4ZLK/ref=sr_1_3?crid=3EKUOWI4I0TPH&dib=eyJ2IjoiMSJ9.o-__6ZPnzwQBCpeW31p0A88dFFwjOTuEWsjkvT8sExsb9SE10-HCqRW_5ZP97t9pd-DQuqufTp86X7HPM7EesiD7F-yJ8BmlSgs6qHjx_CVIe1MPWTMu8tOzNuQ9gWuNtYNdM80nLqvsgEyD2z1Sb2ydbFVy5ucKe9n10eKNo49A4bm-VlTztKze8e8pjXHD-wVRZi1yijEPEkgRSaC49IUj48IpOAKaU6UdQ8m4ShQ.dZj-QkTlFM-wBbsmfydfaeeaXNOvIZOLzC1scVItAI4&dib_tag=se&keywords=android+tablet&qid=1719172642&sprefix=android+tablet%2Caps%2C251&sr=8-3,https://m.media-amazon.com/images/I/616otiZuSIL._SY355_.jpg,"? Storage? 3 GB RAM | 32 GB ROM | Expandable storage Up to 512 GB;?Large Screen and Clear Visuals? HONOR Pad X8 equipped with 10.1-inch HONOR FullView display, with 80% screen-to-body ratio, sharp screen technology for transparent visuals; ?Lightweight and Portable? Weight only 460g, with a 93% aluminum body and a curved surface designed, as thin as 7.55mm easy to fit the curvature of the palm;?Multi-Window of Efficient Learning? With the Split-Screen function opens multiple apps on the same screen at the same time. No matter how many tasks you have, you'll be able to handle them easily; ?Silky Smooth Experience? The new Magic UI 6.1 system based on the latest android 12, Equipped with a new Mediatek MT8786 8-core processor, with comprehensively improved higher running speeds; ?Immersive Audio Experience? HONOR Pad using 1620 high-amplitude dual speakers and Smart PA to deliver even more thunderous audio. With the HONOR Histen s support, 360° sound field that immerses you in every single tone; ?Eye Protection and E-book Mode? HONOR Pad X8 has been certified by TÜV Rheinland for low blue light, with multiple eye protection modes to effectively filter harmful blue light and reduce eye fatigue. E-book Modes bring you a paper-like book display effect to protect your eyes; Ram Memory Installed Size: 3.0GB; Memory Storage Capacity: 32.0GB; Warranty Type: 1 Year Manufacturer Warranty","Tablet is just okay in all aspects, nothing too spectacular about it but nothing is bad either, and it is cheap enough ( I got it for 8999 Rupees). It just simply delivers what you can expect from an Android tablet at this low price.. You can use it for watching stuff on streaming services at Full HD resolution , netflix prime video hotstar etc all work satisfactorily on this device. And its also okay for reading books/manga thanks to the big and crisp IPS screen.

Pros-
1. 10 inch IPS Full HD screen
2. Okay battery life (lasts for about a day)
3. Surprisingly decent stereo speakers
4. Comes with Android 12 and mostly bloat-free experience, there are a few useless pre-installed apps but you can uninstall/disable all of it pretty easily
5. All Google apps ecosystem are also available on this

Cons-
1. no headphone jack so you need to use bluetooth earphones
2. brightness a bit lacking if you use it in bright area and the screen is also susceptible to glare
3. charging is kinda slow
4. RAM is a bit low at just 3GB so if you multi-task the apps in background usually gets cleared out from memory

Overall I suppose it is fine for an absolutely cheap entry level tablet , cant really expect much more at this price.; After nearly two weeks of using the Honor X8 3/32 tablet, I wanted to share my experience. This tablet truly offers exceptional value for money.

Display: While the display brightness is a bit lower than optimal, the video quality is good overall.

Design: The tablet has an attractive appearance and feels well-made. Its quality gives off a rich feel.

Battery: The battery life is satisfactory, lasting for around 12 hours with intermittent use. However, charging speed, even with a fast charger, is disappointingly slow.

Performance: The tablet's performance is decent across various tasks, thanks to the Mediatek Helio G80 processor and Android 12 with Magic UI 6.1.

Camera: Although not the tablet's strongest feature, the cameras serve their general purpose adequately.

Speakers: The stereo speakers produce impressive sound quality.

Additional Features: Efficient Bluetooth connectivity and support for dual-band WiFi (2.4GHz and 5GHz) are notable highlights. However, the storage transfer speed averages around 20MBps.

User Experience: Despite having only 3GB of RAM, the tablet delivers smooth performance. However, the limited 32GB internal storage, mostly occupied by preinstalled apps, may necessitate purchasing external memory. Additionally, there is a slight touch sensitivity issue, albeit rare and manageable.

Conclusion: The Honor X8 3/32 tablet excels in tasks such as video streaming, reading, light gaming, and multitasking. Its affordability and reliable performance make it a standout choice in its price range. While it lacks certain accessories like a charger and flipback cover, its overall value proposition remains unbeatable. I highly recommend it to anyone seeking an affordable yet capable tablet solution.; Hello all,

I recently purchased the Honor Pad X8 at an effective price of 9.9K. And at this price this is unbeatable! Please note that no charger is included in the box - only the USB cable.
Below are the pros & cons:

Pros:

Crisp 10.1 inch FHD LCD display (60Hz only though - can't expect 120Hz under 10K)
Good sound quality, with good enough base. It becomes quite loud at full volume
Metallic finish, though it's mostly plastic.
File transfers are fairly fast when connected to a PC
Android 12 out of the box, which is just 1 generation old as of 2023
Can play 4K videos too
USB type C support

Cons:

Below average cameras (Rear is 5MP with 1080p/30FPS recording, front is 2MP with only 720p/30FPS recording)
Charges at 10 watts only, so takes a long time to charge the 5100mAH battery
A bit on the heavier side at 460 grams.
No charger included in the box
No 3.5mm jack

I don't know about the gaming performance as I don't play games. But as far as I know, the Helio G80 processor (though over 3 years old in 2023) in this can handle casual gaming & gaming at lower settings.
What I can definitely say is that this is a perfect tablet for watching movies, listening to music, taking online classes, working on documents, video calls etc.; For the price its good. Display is good and battery life too. Its a bit heavier but great for a student. Only con no charger in box; Excellent product, good value for money, good touch sensivity , ease of use , smooth UI , good graphics, high speed for 3: 32 variant only high RAM can be higher speed; Amazing device at this price range....compared with mobile , some features missing...but goof battery backup...for average users , it's comes with 2 , 3 days...big screen very useful for official workers...also enjoyed the reels videos viewers. then two minus point it hasn't jack pin for headsets , only bluetooth headphones and comes without charger.; Clean and simple relatively thin but sturdy product. I needed a big screen with decent clarity & got it. Charging I had 18w charger which charges well. I only felt the absence of 3.5mm jack. Decent performance by Honor X8 tablet. Let me come back after a week of use."
"OnePlus Pad Go 28.85cm (11.35 inch) 2.4K 7:5 Ratio ReadFit Eye Care LCD Display, Dolby Atmos Quad Speakers,Wi-Fi Only, 8GB RAM 128 GB ROM Expandable Up-to 1TB, Twin Mint Colour","19,999",https://www.amazon.in/OnePlus-28-85cm-11-35-inch-2-4K/dp/B0CJ94X1NV/ref=sr_1_4?crid=3EKUOWI4I0TPH&dib=eyJ2IjoiMSJ9.o-__6ZPnzwQBCpeW31p0A88dFFwjOTuEWsjkvT8sExsb9SE10-HCqRW_5ZP97t9pd-DQuqufTp86X7HPM7EesiD7F-yJ8BmlSgs6qHjx_CVIe1MPWTMu8tOzNuQ9gWuNtYNdM80nLqvsgEyD2z1Sb2ydbFVy5ucKe9n10eKNo49A4bm-VlTztKze8e8pjXHD-wVRZi1yijEPEkgRSaC49IUj48IpOAKaU6UdQ8m4ShQ.dZj-QkTlFM-wBbsmfydfaeeaXNOvIZOLzC1scVItAI4&dib_tag=se&keywords=android+tablet&qid=1719172642&sprefix=android+tablet%2Caps%2C251&sr=8-4,https://m.media-amazon.com/images/I/51oj5gE7P+L._SY450_.jpg,"[Outstanding Display]: 2.4K 2408x1720 Ultra-High resolution, 11.35-inch/28.85cm Massive Display, 7:5 ReadFit screen ratio & 260 PPI with 400 nits brightness.; [Awesome Audio]: OnePlus omnibearing sound with Dolby Atmos Quad Speakers; [Eye Care]: Low Blue Light (TÜV Rheinland Certified) ; Intelligent brightness ; DC Dimming ; Bedtime Mode; [Seamless connectivity]: Wifi with cellular data sharing support [Processor & Operating system]: MediaTek Helio G99, Android Oxygen OS 13.2; [Storage & Battery]: 8GB RAM with 128GB storage ; 8000 mAh big battery with up-to 514 hours of standby, 33W SUPERVOOC fast charging; Ram Memory Installed Size: 8.0GB; Battery Capacity: 8000.0 mAH; Compatible Devices: Headphone; Memory Storage Capacity: 128.0GB; Model: ?Opd2305","If you are looking for budget tablet and confused which one to buy. Look no further and buy this one.
1. Screen quality very nice.
2. Sound quality I bet it beats apple 9th gen by far
3. It gives you 128GB with an option to increase further using SD card. Why would somebody stuck with 64GB. I do heavy download of videos for offline, 64 gb out of which almost 20GB used by OS.
4. In Android world OnePlus Oxygen OS stands out. No bloatware, clean and fast. Also promised 4 yrs updates.
5. People say G99 processor, performance is not good. I am spending around 17000 rs . I am getting decent performance for casual gaming and watch media content in good quality resolution, which I may say for most is sole purpose of tablet.
6. Tablet is mostly bought for on the go content watching. This one has very good battery backup and better than ipad ,fast charging.
7. Yes 400 nits max screen brightness, people say less for outdoor. But think how many times you go out in bright sunlight, either you watch in vehicle and in shades. Also 400 nits consumes less battery.
8. If you want tablet to be like laptop with only 17000 rs. Look for something else.
9. For students only con it does not support apple pencil kind of pencil for note taking. But then it is half the price from apple ipad 9 + apple pencil. And note taking works with cheap magnetic tip pencils.
10. Quality, the moment you hold it, it gives premium feeling.

Overall best budget tablet, value for money .; Sim 4G with wifi calling enabled working fine
Battery is good
Ram and memory superb
Decent device for stock trading
WhatsApp calling available
Video calling is available
Display is good & Sound quality is great
Charging is good
Camera decent
Useful split window
Dual window
Best short cuts
Connect to external Bluetooth ear phone
There are several hidden features; Good product for viewing and reading.Charging is excellent and battery life long lasting.
Performance wise very good. Very smooth in handling. Money's worth.; Was looking for a basic tablet around ₹20k to read pdf books. This does that job well . Also videos from apps are good. Can play games as well (unless you are looking for high fps games with6any frame drops)

Very satisfied. Serves my purpose well.

Pros:
+Vibrant display in 7:5 magazine aspect ratio
+ Enough performance for all day today tasks
+ Sleek design
+ Good battery life
Cons:
- Fingerprint sensor on this would haveade it complete tablet; Display is very nice sound is good design and battery back up is good .. overall product is good; Superb big sized screen.It's delightful. Stunning Dolby Atmos with 4 speakers.Good processor and fine bright display.Almost a premium tablet at a bargain price.Feels like Apple iPad at a fraction of its price.; I bought this tablet to study, so on this point the tablet does its work well. The camera is very basic which I can't complain about given the price point. However, my only concerns are the battery and the delivery experience.

First of all, when I received the product two days ago, I found that the packaging was clearly tampered. The seal on the folio case was broken and though the seal was intact on the tablet's packaging case, I could still find clues it was opened before I did. I was very very concerned but because I couldn't find any noticeable damage the customer service couldn't do anything.

Secondly, the battery according to me is draining faster than what should be normal for a brand new device. For example, if I watch a video for 1.5 hours, the battery will drain from 100% to 89%. This is my first tablet so I don't know if this is normal but I am concerned that in the long run this draining will be speed up. Though the charging happens super fast. That's a good point.

The refresh rate is okay. It took me some time to get used to the slight delays and occassional stutters when scrolling, but gradually I got used to it.

Because of the large display it offers a good experience in reading and watching lectures. Overall, I think it's a good and affordable tablet for those who have basic requirements in studing and taking notes. Except I'm still anxious about the battery. I am using a capacitative stylus for note taking.; Amazing screen quality smooth touch good performance camera is also good, quick connectivity, I loved it. Charging is also good, all features are good. Feels amazing to use very classy look"
"Lenovo Tab M10 Fhd 3Rd Gen|10.1 Inch (25.65 Cm) Wuxga IPS Display|100% Srgb|4 Gb Ram,64 Gb Rom|Octa-Core Processor|Wi-Fi|5100Mah Battery|Dual Speakers|Tüv Rheinland Low Blue Light Certified","10,999",https://www.amazon.in/Lenovo-Display-Speakers-Octa-Core-Processor/dp/B0B8DKL2SD/ref=sr_1_5?crid=3EKUOWI4I0TPH&dib=eyJ2IjoiMSJ9.o-__6ZPnzwQBCpeW31p0A88dFFwjOTuEWsjkvT8sExsb9SE10-HCqRW_5ZP97t9pd-DQuqufTp86X7HPM7EesiD7F-yJ8BmlSgs6qHjx_CVIe1MPWTMu8tOzNuQ9gWuNtYNdM80nLqvsgEyD2z1Sb2ydbFVy5ucKe9n10eKNo49A4bm-VlTztKze8e8pjXHD-wVRZi1yijEPEkgRSaC49IUj48IpOAKaU6UdQ8m4ShQ.dZj-QkTlFM-wBbsmfydfaeeaXNOvIZOLzC1scVItAI4&dib_tag=se&keywords=android+tablet&qid=1719172642&sprefix=android+tablet%2Caps%2C251&sr=8-5,https://m.media-amazon.com/images/I/61yBf2b9dFL._SX425_.jpg,10.1 inch FHD (IPS LCD) (1920*1200) display| 100% sRGB| 320 nits brightness; 8.5 mm thin| 460 gm light|Android 11| Unisoc T610 octa core processor|; 4 GB RAM | 64 GB ROM expandable upto 128 GB| 5100 mAH battery| 10 hours video playback time; Dual speakers with Dolby Atmos| One microphone| Face Unlock technology; 8 MP Auto-Focus Rear Camera| 5 MP Auto-Focus Front Camera| 1 year warranty; Ram Memory Installed Size: 4.0GB; Warranty Type: 1 Year Comprehensive Warranty; Memory Storage Capacity: 64.0GB,"Good to watch OTT; It is worth the price it is offered at and serves the purpose for me which was a big display to watch videos and play games.
Also some office work can be achieved.
Charging takes long and battery does deplete fast if the display brightness is kept high.
Sound wise the speaker media volume is on the low side- my phone is louder. And the call audio quality suffers from some intermittent echo.
Touch and colours are nice enough.
The cover and screen guard that come together with are convenient but the screen guard is not DIY. Mine got way too many bubbles. If you're not practiced with it best take it to a professional to get the job done.; Very amazing product with child lock facilities
Gifted my brother and he is just enjoying it!; Lenovo tab uploaded with lots of application of no use, they occupied almost 18 GB space out of 64GB which is so high. This tab is full of glitches and doesn't work properly. It gets hang and freeze the screen until battery dies. Also get switch off in the middle of work even after having good charged battery. Also phone doesn't work; neither voice reach other side nor comes in clearly. Phone call gives so much disturbance.
Now it is not getting switch on after getting switch off in the middle of my work.
So Disappointed. Just Waste of Money, time and Efforts.
It is not worth buying - Not Even 1%.; Awesome product, good sound ,charging ,it's worth; It is not good; For now its charge as fast
Take time to to battery low
I buy for mh daughter as a gift; Have been using it in house on Wifi. After few weeks of usage all i can say is it performs all work excellently, no sluggishness while using."
