Title,Price,Link,Image URL,Description,Reviews
"Samsung Galaxy Tab A9+ 27.94 cm (11.0 inch) Display, RAM 8 GB, ROM 128 GB Expandable, Wi-Fi Tablet, Graphite","19,999",https://www.amazon.in/Samsung-Galaxy-Tab-A9-Expandable/dp/B0CJ38X1BQ/ref=sr_1_8?crid=3EKUOWI4I0TPH&dib=eyJ2IjoiMSJ9.o-__6ZPnzwQBCpeW31p0A88dFFwjOTuEWsjkvT8sExsb9SE10-HCqRW_5ZP97t9pd-DQuqufTp86X7HPM7EesiD7F-yJ8BmlSgs6qHjx_CVIe1MPWTMu8tOzNuQ9gWuNtYNdM80nLqvsgEyD2z1Sb2ydbFVy5ucKe9n10eKNo49A4bm-VlTztKze8e8pjXHD-wVRZi1yijEPEkgRSaC49IUj48IpOAKaU6UdQ8m4ShQ.dZj-QkTlFM-wBbsmfydfaeeaXNOvIZOLzC1scVItAI4&dib_tag=se&keywords=android+tablet&qid=1719172642&sprefix=android+tablet%2Caps%2C251&sr=8-8,https://m.media-amazon.com/images/I/61afkty1foL._SY450_.jpg,"Outstanding vividness with 27.94 cm (11.0 ) LCD display, 90 Hz Refresh Rate, 1920 x 1200 (WQXGA); Qualcomm Snapdragon SM6375 Processor; 8 MP AF Rear Camera, 5 MP FF Front camera,Quad Speakers Surround Sound; 7040 mAh Battery; Memory Storage Capacity: 128.0GB; Ram Memory Installed Size: 8.0GB; Battery Capacity: 7040.0 mAH; Special Features: Fast Charging","Like the A9 plus wify tab verymuch !
Great 11 inch display, i did not feel any lag ever during my office activities of reading pdf, powerpoint, seeing videos and mp4. I do not do gaming.
Lound ,crystal clear sound with spatial distinction, supports dolby .
Has bluetooth and also headphone jack.
Side slot for microSD card upto 1 TB. My wify model does not support sim.
Those who have bought wify+sim suppport, the side slot supports microSD card and sim.
Usual Samsung One UI ...very convenient and easy to switch contacts, sms, downloads etc. Also logging in and setting up the tab using my another samsung phone was super easy and headache free. Also the Quallcom Snapdragon processor is reliable and heavy duty proof.
Dislike...
The main camera in rear is mediocre. Compared to such great device, configuration and display support ,this camera is just plain ordinary without much features.; This is awesome tablet. Very fast and battery life is good too. Highly satisfied with the purchase. I got this on offer for less than 13k in May 24.; Pros:
8 gb Ram..nice speed no lags..
No heating issue even when playing or charging.
Good big sound.
Good resolution..1080 p youtube videos
Good for reading..eyeshield..feature..screen size is big enough for a book page to fit comfirtably..this is what I wanted..
Con:
Battery is drying up even when I am reading only..in one day..every night I need to charge..my previous tab ..samsung 2 gb used to afford me more battery..but given 8gb speed its understandable..
If your requirement is only reading..better go with s6 lite 4 gb which also comes with pencil. But you want some multimedia n games too..then in this price range this one is best with 8gb RAM.
I am a happy customer. 5 out of 5 stars.; 1)First of all the seal was broken.
2) I found glues are shown between screen and body on all sides of the tab,which looks like a repaired one.
3)Month and Year in the box is showing March 2024 but I found so many screen shots in image folder, whose created date is showing Nov 2023.
4)There is no temporary screen guard on the screen as new phones or tabs usually have.; I got this at a very low price of 14k so it is a value for money amazing speaker quality good screen size for this price point; Has most of the features required in the latest technology tablet. Sufficient speed, memory and picture quality.; Overall tablet is nice ...but if you are using it more than 3.5 hours...then pls dont but it.; i had bought in february and now in june no issues. Tab works smoothly ,only battery drains out quickly even if not using it so have to charge frequently."
"HONOR Pad X8 with Free Flip-Cover, 25.65cm (10.1 inch) FHD Display, 4GB RAM 64GB ROM, Mediatek MT8786, Android 12, TUV Rheinland Certified Eye Protection, Up to 14 Hours Battery WiFi Tablet, Blue Hour","10,499",https://www.amazon.in/Flip-Cover-Mediatek-Rheinland-Certified-Protection/dp/B0C6DVNFKZ/ref=sr_1_9?crid=3EKUOWI4I0TPH&dib=eyJ2IjoiMSJ9.o-__6ZPnzwQBCpeW31p0A88dFFwjOTuEWsjkvT8sExsb9SE10-HCqRW_5ZP97t9pd-DQuqufTp86X7HPM7EesiD7F-yJ8BmlSgs6qHjx_CVIe1MPWTMu8tOzNuQ9gWuNtYNdM80nLqvsgEyD2z1Sb2ydbFVy5ucKe9n10eKNo49A4bm-VlTztKze8e8pjXHD-wVRZi1yijEPEkgRSaC49IUj48IpOAKaU6UdQ8m4ShQ.dZj-QkTlFM-wBbsmfydfaeeaXNOvIZOLzC1scVItAI4&dib_tag=se&keywords=android+tablet&qid=1719172642&sprefix=android+tablet%2Caps%2C251&sr=8-9,https://m.media-amazon.com/images/I/61RupxzNlRL._SY355_.jpg,"? Storage? 4 GB RAM | 64 GB ROM | Expandable storage Up to 512 GB;?Large Screen and Clear Visuals? HONOR Pad X8 equipped with 10.1-inch HONOR FullView display, with 80% screen-to-body ratio, sharp screen technology for transparent visuals; ? Flip cover for Immersive sound and viewing pleasure ?Exclusively designed Flip cover for HONOR Pad X8. The sleek and lightweight stand-fold design is super convenient for providing different viewing angles when watching videos, video conferences, texting, gaming or learning, etc.;?Lightweight and Portable? Weight only 460g, with a 93% aluminum body and a curved surface designed, as thin as 7.55mm easy to fit the curvature of the palm; ?Multi-Window of Efficient Learning? With The Split-Screen function opens multiple apps on the same screen at the same time. No matter how many tasks you have, you'll be able to handle them easily;?Silky Smooth Experience? The new Magic UI 6.1 system based on the latest Android 12, Equipped with a new MediaTek MT8786 8-core processor, with comprehensively improved higher running speeds; ? Ideal Usage ? Entertainment, Online Classes & Meetings, Study, and Gaming;?Immersive Audio Experience? HONOR Pad uses 1620 high-amplitude dual speakers and Smart PA to deliver even more thunderous audio. With the HONOR Histen s support, 360° sound field that immerses you in every single tone; ?Eye Protection and E-book Mode? HONOR Pad X8 have been certified by TÜV Rheinland for low blue light, with multiple eye protection modes to effectively filter harmful blue light and reduce eye fatigue. E-book Modes bring you a paper-like book display effect to protect your eyes; Memory Storage Capacity: 64.0GB; Warranty Type: 1 Year Manufacturer Warranty; Ram Memory Installed Size: 4.0GB","Tablet is just okay in all aspects, nothing too spectacular about it but nothing is bad either, and it is cheap enough ( I got it for 8999 Rupees). It just simply delivers what you can expect from an Android tablet at this low price.. You can use it for watching stuff on streaming services at Full HD resolution , netflix prime video hotstar etc all work satisfactorily on this device. And its also okay for reading books/manga thanks to the big and crisp IPS screen.

Pros-
1. 10 inch IPS Full HD screen
2. Okay battery life (lasts for about a day)
3. Surprisingly decent stereo speakers
4. Comes with Android 12 and mostly bloat-free experience, there are a few useless pre-installed apps but you can uninstall/disable all of it pretty easily
5. All Google apps ecosystem are also available on this

Cons-
1. no headphone jack so you need to use bluetooth earphones
2. brightness a bit lacking if you use it in bright area and the screen is also susceptible to glare
3. charging is kinda slow
4. RAM is a bit low at just 3GB so if you multi-task the apps in background usually gets cleared out from memory

Overall I suppose it is fine for an absolutely cheap entry level tablet , cant really expect much more at this price.; After nearly two weeks of using the Honor X8 3/32 tablet, I wanted to share my experience. This tablet truly offers exceptional value for money.

Display: While the display brightness is a bit lower than optimal, the video quality is good overall.

Design: The tablet has an attractive appearance and feels well-made. Its quality gives off a rich feel.

Battery: The battery life is satisfactory, lasting for around 12 hours with intermittent use. However, charging speed, even with a fast charger, is disappointingly slow.

Performance: The tablet's performance is decent across various tasks, thanks to the Mediatek Helio G80 processor and Android 12 with Magic UI 6.1.

Camera: Although not the tablet's strongest feature, the cameras serve their general purpose adequately.

Speakers: The stereo speakers produce impressive sound quality.

Additional Features: Efficient Bluetooth connectivity and support for dual-band WiFi (2.4GHz and 5GHz) are notable highlights. However, the storage transfer speed averages around 20MBps.

User Experience: Despite having only 3GB of RAM, the tablet delivers smooth performance. However, the limited 32GB internal storage, mostly occupied by preinstalled apps, may necessitate purchasing external memory. Additionally, there is a slight touch sensitivity issue, albeit rare and manageable.

Conclusion: The Honor X8 3/32 tablet excels in tasks such as video streaming, reading, light gaming, and multitasking. Its affordability and reliable performance make it a standout choice in its price range. While it lacks certain accessories like a charger and flipback cover, its overall value proposition remains unbeatable. I highly recommend it to anyone seeking an affordable yet capable tablet solution.; Hello all,

I recently purchased the Honor Pad X8 at an effective price of 9.9K. And at this price this is unbeatable! Please note that no charger is included in the box - only the USB cable.
Below are the pros & cons:

Pros:

Crisp 10.1 inch FHD LCD display (60Hz only though - can't expect 120Hz under 10K)
Good sound quality, with good enough base. It becomes quite loud at full volume
Metallic finish, though it's mostly plastic.
File transfers are fairly fast when connected to a PC
Android 12 out of the box, which is just 1 generation old as of 2023
Can play 4K videos too
USB type C support

Cons:

Below average cameras (Rear is 5MP with 1080p/30FPS recording, front is 2MP with only 720p/30FPS recording)
Charges at 10 watts only, so takes a long time to charge the 5100mAH battery
A bit on the heavier side at 460 grams.
No charger included in the box
No 3.5mm jack

I don't know about the gaming performance as I don't play games. But as far as I know, the Helio G80 processor (though over 3 years old in 2023) in this can handle casual gaming & gaming at lower settings.
What I can definitely say is that this is a perfect tablet for watching movies, listening to music, taking online classes, working on documents, video calls etc.; For the price its good. Display is good and battery life too. Its a bit heavier but great for a student. Only con no charger in box; Excellent product, good value for money, good touch sensivity , ease of use , smooth UI , good graphics, high speed for 3: 32 variant only high RAM can be higher speed; Amazing device at this price range....compared with mobile , some features missing...but goof battery backup...for average users , it's comes with 2 , 3 days...big screen very useful for official workers...also enjoyed the reels videos viewers. then two minus point it hasn't jack pin for headsets , only bluetooth headphones and comes without charger.; Clean and simple relatively thin but sturdy product. I needed a big screen with decent clarity & got it. Charging I had 18w charger which charges well. I only felt the absence of 3.5mm jack. Decent performance by Honor X8 tablet. Let me come back after a week of use."
"Lenovo Tab M10 HD 2nd Gen (10.1 inch(25cm), 2 GB, 32 GB, Wi-Fi+4G LTE), Platinum Grey with Metallic Body and Octa Core Processor","7,348",https://www.amazon.in/Lenovo-Wi-Fi-Platinum-Metallic-Processor/dp/B094NH8KGD/ref=sr_1_10?crid=3EKUOWI4I0TPH&dib=eyJ2IjoiMSJ9.o-__6ZPnzwQBCpeW31p0A88dFFwjOTuEWsjkvT8sExsb9SE10-HCqRW_5ZP97t9pd-DQuqufTp86X7HPM7EesiD7F-yJ8BmlSgs6qHjx_CVIe1MPWTMu8tOzNuQ9gWuNtYNdM80nLqvsgEyD2z1Sb2ydbFVy5ucKe9n10eKNo49A4bm-VlTztKze8e8pjXHD-wVRZi1yijEPEkgRSaC49IUj48IpOAKaU6UdQ8m4ShQ.dZj-QkTlFM-wBbsmfydfaeeaXNOvIZOLzC1scVItAI4&dib_tag=se&keywords=android+tablet&qid=1719172642&sprefix=android+tablet%2Caps%2C251&sr=8-10,https://m.media-amazon.com/images/I/71UXXKK2gSL._SX450_.jpg,"10.1"" HD (1280x800) display with TDDI technology and 400 nits brightness and TUV Rhienland certified eye protection; Full aluminium-alloy back cover with 85% screen-to-body ratio; 2GB RAM, 32GB ROM expandable upto 256 GB, ex-FAT upto 1 TB; MediaTek Helio P22T octa-core processor with 2.3GHz frequency; 8 MP Rear Camera, 5 MP front camera, Dual Dolby Atmos optimized speakers, Google Kids Space","; Product is good in all aspect

I opted for exchange with my iPhone, while preparing for exchange already we have formatted or remove the iCloud from the mobile for exchanging but they are asking a verification code that too in the exchanging mobile and later I connected to Wi-Fi and opened Amazon website but in that there is no option about verification code so the delivery person is forcing me to pay the charge or cancel the product later I paid the exchange value and receive the product but while buying I paid 129 for the exchange pickup but it’s not reduced in the final value it’s a bad experience; The unboxed Tab had shows that it's been reset to factory settings please use previously used pattern or Gmail I'd to unlock.

Amazon can't you verify incase return product is used or any factory reset are happened.

Lenovo on other hand have a worst warranty registration process. Upon saying tablet having issue they want register warranty first, then only service can be taken up. After sending mail to pop@lenovo.com it's been 10 days No reply.

If ask Lenovo customer care then we didn't receive your mail send mail from different account and takes 3 days for warranty registration only. Its been 15days just sending mails and taking with Amazon and Lenovo teams where each is blaming other one.; my son just stepped into his 1st grade in school. in the last week of may 2021 came the good news that he will have online classes. tried the online classes with a mobile phone--- the screen is so small that he would keep it close to his face. tried the laptop but handling it was difficult for him. both of us being working parents its difficult to be beside him during his classes. then i started to search for a tablet and came across lenovo. saw a few good reviews and had used lenovo products earlier. so went for it. nice product real big screen its about 10 cm big. the touch screen is very responsive . the screen colour too are good. the only flaw was lenovo had some chinese video software which kept popping up. so i had to delete the whole app off pretty simple.
then its the good service from amazon. delivered before the due date even during these lockdown times. now my son listens to his class and his grandparents also can monitor it. i bought the one with a sim card so that even if there is no power the internet connection for the video does not go off.; Quality isn’t good enough so as software so laggy. Poor display etc. Final conclusion don’t waste your money.; Less speed than expected.; Value for money; Very slow n poor performance. Hangs again n again."
Wishtel IRA Duo Pro (10.4 inch) Tablet + Keyboard | 6GB RAM 64GB ROM | Wi-Fi + 4G Volte | Dual SIM | 8000mAH Battery | 2Ghz Octacore Processor | Android 13 | Calling Tablet | Included Free Accessories,"23,999",https://www.amazon.in/sspa/click?ie=UTF8&spc=MTo4MTczMTY5NTM1MjE5MTc0OjE3MTkxNzI2NDI6c3BfbXRmOjMwMDIyNzU0MzI5NDIzMjo6MDo6&url=%2FWishtel-Keyboard-Octacore-Processor-Accessories%2Fdp%2FB0CWR1VM9X%2Fref%3Dsr_1_11_sspa%3Fcrid%3D3EKUOWI4I0TPH%26dib%3DeyJ2IjoiMSJ9.o-__6ZPnzwQBCpeW31p0A88dFFwjOTuEWsjkvT8sExsb9SE10-HCqRW_5ZP97t9pd-DQuqufTp86X7HPM7EesiD7F-yJ8BmlSgs6qHjx_CVIe1MPWTMu8tOzNuQ9gWuNtYNdM80nLqvsgEyD2z1Sb2ydbFVy5ucKe9n10eKNo49A4bm-VlTztKze8e8pjXHD-wVRZi1yijEPEkgRSaC49IUj48IpOAKaU6UdQ8m4ShQ.dZj-QkTlFM-wBbsmfydfaeeaXNOvIZOLzC1scVItAI4%26dib_tag%3Dse%26keywords%3Dandroid%2Btablet%26qid%3D1719172642%26sprefix%3Dandroid%2Btablet%252Caps%252C251%26sr%3D8-11-spons%26sp_csd%3Dd2lkZ2V0TmFtZT1zcF9tdGY%26psc%3D1,https://m.media-amazon.com/images/I/711wD-cCIsL._SY450_.jpg,"CAMERA: 13MP primary camera and 8MP front-facing camera for clear photos and video calls.; TABLET & STYLUS: 2-in-1 detachable tablet with stylus pen for easy note-taking and drawing.; DISPLAY: 26.41 centimeters (10.4-inch) capacitive touchscreen with 2000*1200 pixels resolution for vivid visuals.; PERFORMANCE: Android 13 operating system with 2.0Ghz Octa Core processor, 6GB 4. 4. RAM, 64GB internal memory expandable up to 1TB for smooth multitasking and ample storage.; BATTERY & WARRANTY: 8000mAH lithium-ion battery for long-lasting use. 1 year manufacturer warranty for the device and 6 months manufacturer warranty for in-box accessories including batteries from the date of purchase.",
Wishtel IRA T811 4G | 8.4 inch FHD in-Cell Display Tablet with 4GB RAM & 64GB ROM | 5500 mAH Battery | Android 13 | 2 GHz Octa Core Processor | Included Free Accessories,"11,999",https://www.amazon.in/sspa/click?ie=UTF8&spc=MTo4MTczMTY5NTM1MjE5MTc0OjE3MTkxNzI2NDI6c3BfbXRmOjMwMDIyNzU0MzI5NDAzMjo6MDo6&url=%2FWishtel-Display-Processor-Included-Accessories%2Fdp%2FB0CVXQ23HG%2Fref%3Dsr_1_12_sspa%3Fcrid%3D3EKUOWI4I0TPH%26dib%3DeyJ2IjoiMSJ9.o-__6ZPnzwQBCpeW31p0A88dFFwjOTuEWsjkvT8sExsb9SE10-HCqRW_5ZP97t9pd-DQuqufTp86X7HPM7EesiD7F-yJ8BmlSgs6qHjx_CVIe1MPWTMu8tOzNuQ9gWuNtYNdM80nLqvsgEyD2z1Sb2ydbFVy5ucKe9n10eKNo49A4bm-VlTztKze8e8pjXHD-wVRZi1yijEPEkgRSaC49IUj48IpOAKaU6UdQ8m4ShQ.dZj-QkTlFM-wBbsmfydfaeeaXNOvIZOLzC1scVItAI4%26dib_tag%3Dse%26keywords%3Dandroid%2Btablet%26qid%3D1719172642%26sprefix%3Dandroid%2Btablet%252Caps%252C251%26sr%3D8-12-spons%26sp_csd%3Dd2lkZ2V0TmFtZT1zcF9tdGY%26psc%3D1,https://m.media-amazon.com/images/I/71Qr5dfFguL._SY450_.jpg,"CAMERA: Capture stunning photos and videos with the 8MP AF rear camera, and enjoy clear video calls with the 5MP front camera, ensuring you never miss a moment.; DISPLAY: Immerse yourself in a cinematic viewing experience on the 8.4-inch FHD in-cell display with a resolution of 1920 x 1200 pixels, delivering crisp and vibrant visuals.; OPERATING SYSTEM: Experience the latest features and enhancements with Android 13, powered by a 2GHz Octa-Core processor, ensuring smooth performance for all your tasks.; MEMORY: Enjoy seamless multitasking and ample storage with 4GB of RAM and 64GB of internal memory, expandable up to 1TB, allowing you to store all your favorite apps, photos, and videos.; BATTERY: Stay connected and productive throughout the day with the 5500mAh li-polymer battery, providing long-lasting power for your device.",
"Lenovo Calling Tab M8 2nd Gen Tablet (8-inch, 2GB, 32GB, Wi-Fi + 4G LTE + Calling), Iron Grey","5,849",https://www.amazon.in/Lenovo-Calling-Tab-2GB-32GB/dp/B08DD7VT8P/ref=sr_1_13?crid=3EKUOWI4I0TPH&dib=eyJ2IjoiMSJ9.o-__6ZPnzwQBCpeW31p0A88dFFwjOTuEWsjkvT8sExsb9SE10-HCqRW_5ZP97t9pd-DQuqufTp86X7HPM7EesiD7F-yJ8BmlSgs6qHjx_CVIe1MPWTMu8tOzNuQ9gWuNtYNdM80nLqvsgEyD2z1Sb2ydbFVy5ucKe9n10eKNo49A4bm-VlTztKze8e8pjXHD-wVRZi1yijEPEkgRSaC49IUj48IpOAKaU6UdQ8m4ShQ.dZj-QkTlFM-wBbsmfydfaeeaXNOvIZOLzC1scVItAI4&dib_tag=se&keywords=android+tablet&qid=1719172642&sprefix=android+tablet%2Caps%2C251&sr=8-13,https://m.media-amazon.com/images/I/61LdWaeRtML._SX450_.jpg,"processor_description: MediaTek Helio A22 Tab quad-core; 8MP rear camera with auto focus | 2MP front camera; 20.32 centimeters (8-inch) with 1280 x 800 pixels resolution; Android v9 Pie operating system with 2.0 GHz MediaTek Helio A22 Tab quad-core processor, 2GB RAM, 32GB internal memory expandable up to 128GB, Single Nano SIM; 5000mAH lithium-ion battery; Sleek and Premium Metallic Body design ; Vivid 8³ IPS (1280 x 800) LCD, 350 nits capacitive 10 point multitouch","Very good product with awesome battery life. Good product for daily light usage.; It's a value for money.good but don't expect too much from this.; Year of manufacture 2021. Screen not fitted properly. Screen bleeding issue. Outdated micro USB port and slow charging 5 volt 1 ampere charger; ; Performance is not good.; Work perfectly for normal use; Good one; Scratches in screen, poor quality display"
"HONOR Pad X9 with Free Flip-Cover 11.5-inch (29.21 cm) 2K Display, Snapdragon 685, 7GB (4GB+3GB RAM Turbo), 128GB Storage, 6 Speakers, Up-to 13 Hours Battery, Android 13, WiFi Tablet, Metal Body, Gray","14,999",https://www.amazon.in/Flip-Cover-11-5-inch-Display-Snapdragon-Speakers/dp/B0C9V7RYWD/ref=sr_1_14?crid=3EKUOWI4I0TPH&dib=eyJ2IjoiMSJ9.o-__6ZPnzwQBCpeW31p0A88dFFwjOTuEWsjkvT8sExsb9SE10-HCqRW_5ZP97t9pd-DQuqufTp86X7HPM7EesiD7F-yJ8BmlSgs6qHjx_CVIe1MPWTMu8tOzNuQ9gWuNtYNdM80nLqvsgEyD2z1Sb2ydbFVy5ucKe9n10eKNo49A4bm-VlTztKze8e8pjXHD-wVRZi1yijEPEkgRSaC49IUj48IpOAKaU6UdQ8m4ShQ.dZj-QkTlFM-wBbsmfydfaeeaXNOvIZOLzC1scVItAI4&dib_tag=se&keywords=android+tablet&qid=1719172642&sprefix=android+tablet%2Caps%2C251&sr=8-14,https://m.media-amazon.com/images/I/61cG9RGN9xL._SY450_.jpg,"? Storage? 7GB (4GB+3GB RAM Turbo) | 128 GB ROM;?Large Screen and Clear Visuals? HONOR Pad X9 equipped with an 11.5-inch 120 Hz 2k display, 86% screen-to-body ratio, 400 NITS, and 100% SRGB screen technology for transparent visuals; ? Flip cover for easy viewing ?The sleek and lightweight stand-fold design provides convenient viewing angles when watching videos, video calls, texting, gaming or reading, etc.;?Immersive Audio Experience?6 Cinematic surround speakers comes with HONOR Hi-Res audio technology delivers crystal clear audio and immerses you in every single tone; ?Smooth Experience? The new Magic UI 7.1 system is based on the latest Android 13. The Qualcomm Snapdragon 685 processor provides comprehensive performance;?Lightweight and Portable? Weighing only 495g and with 6.9mm thickness, the metal unibody design will give you the premium look and comfortable feel in your palm; ?Multi-Window for Efficient Working? The Split-Screen function opens multiple apps on the same screen at the same time. Let's you multi-task easily;?Google Kids Space for Efficient Learning? HONOR Pad X9 has pre-installed Google Kids Space, providing students Apps, Books, and Videos available for different age groups; ?Eye Protection and E-book Mode? HONOR Pad X9 is certified by TÜV Rheinland for low blue light and flicker-free eye comfort mode and effectively reduces eye fatigue; Ram Memory Installed Size: 4.0GB; Memory Storage Capacity: 128.0GB; Special Features: Stereo Speakers; Warranty Type: Limited","Amazing tablet in all aspects.; ; Very good tablet in price range. Best in all aspects.; I'm using this product since 8 months...
It's just an amazing tablet for Student, and also for movies, webseries etc
No lag, outstanding performance, multitasking is also very good,and amazing battery backup...
(Just one OS update)
Overall very good product 🙌🏾; 1. The display is TFT but quality TFT, viewing angles are good enough.
2. Sound is clear and rich but not loud even it has 5 speakers and 1 woover.
3. Build quality is best in the segment.
Processor is powerful enough, I play asphalt 9 with highest graphics mode.
4. Battery optimisation is very much good.
5. It charges at 22.5 watt max. It takes time to get fully charged, though you can twik that in settings.
6. Camera is there, can take photos, that's all.
7. 4+3 gb ram is well optimised.

I think this is all you should know about before buying a tablet.; I purchased this tab 15 days ago and I m going to share what is my experience with this device so far
POSITIVES -
Biggest screen in this price range and bezels are narrow 120 hz buttery smooth
Build quality is good sleek design gives u a feel of holding a premium tab 😜
I m a normal user so it gives me around 12-13 hour battery backup
Brightness is good even u don't need to go above 50 %
Bloatwares are uninstallable
Sound quality is good like really really good
Ui is really good not feels outdated ( and obviously it's not )
MagicOS 7.1 gives u a lot of customisation and features
Supports otg no heating
Great for multitasking even some pad in this range don't support multitasking like this one
NEGATIVES -
snapdragon 685 is good for daily activity but not for gamers can play bgmi in low settings but who likes low graphics 😅 casual gaming is good
No charger but company compansated it with a decent quality case ( case and charger cost the same )
Camera is not good and I think no one uses a tablets camera
IN SHORT - if u are not a gamer just close ur eyes and order it u won't regret I promise; Screen Quality not good, Touch is average, battery is not that expected, Weight is good, Charging is too slow, Display is TFT that is worst thing at this price point. No Return option that's another disappointment. Last point Speaker Quality is worst 🙂 doesn't comes with Dolby Atmos also not that loud it has 6 speakers but sound is not more than a dual speaker smartphone.; Product is best in the segement.
Display is wide enough and bright.
Sleek and smooth experience.
Touch is bit laggy, but at this price point can adjust.
No words for sound quality 10/10
Multiscreen is awesome.
Best fit for use of office with presentation, accounts and all.

The only thing which this would have the game changer is sim card support."
