Title,Price,Link,Image URL,Description,Reviews
Fujifilm Instax Camera Mini 99 Premium Edition Pack with 20 Shots,"18,999",https://www.amazon.in/sspa/click?ie=UTF8&spc=MTo1ODI2NjQzMzEwNDQ4MTc1OjE3MTkyMTQ3NTE6c3BfYXRmOjMwMDIxNTg0NjE4NjAzMjo6MDo6&url=%2FFujifilm-Instax-Camera-Premium-Shots%2Fdp%2FB0D1VG31PK%2Fref%3Dsr_1_1_sspa%3Fcrid%3D4JBM3GA1T7F5%26dib%3DeyJ2IjoiMSJ9.X0BDLWsnuDGIJWy5e5VTQZSQ-Zo6YHRSQjpLBytpQogRqjKvaWaw6yy8Ptzmxvrh3U-VGJnXhczGx1Uz2efO8u5_KjyevthnrJj4pc4dYnZK0SEegi7hbde71RDIqPZXBHG9U7Q_iwxA1mOLj_JF_VMD_-FKCO9tbxMpXLOokwJIa3e1HV-EMVH0HszXhUP8o9OfVP0EgKKGwJQ4J75KJ1adQORgioPYefS4KkYpiEk.3tgCh6JQMEGzVW65k93AMNw6TLfd4QVOanNzn39j1M0%26dib_tag%3Dse%26keywords%3Dold%2Banalog%2Bfilm%2Bcameras%26qid%3D1719214751%26sprefix%3Dold%2Banalog%2Bfilmcameras%252Caps%252C213%26sr%3D8-1-spons%26sp_csd%3Dd2lkZ2V0TmFtZT1zcF9hdGY%26psc%3D1,https://m.media-amazon.com/images/I/51Rqiit2b9L._SY550_.jpg,Take a snap and you are ready to create.; Color Effect Control,"Ich habe die INSTAX mini 99 jetzt circa zwei Monate ausgiebig getestet und was soll man sagen - Ich bin total begeistert!
Bei vielen anderen Sofortbildkameras geht es nur um die Momentaufnahme - bei der mini 99 jedoch gibt es viele kleine Feinheiten, die beim Fotografieren richtig Spaß machen.
Sie ist optisch ein richtiger Blickfang und fühlt sich dazu auch sehr hochwertig an. Durch die verschiedenen Einstellräder oder das verstellbare Objektiv hat man ein richtiges analoges Bediengefühl.
Ich bin ein großer Fan von den Farbeffekten. Hiermit sieht jedes Sofortbild nach etwas besonderem aus, egal wie einfach das Motiv war.
Von der Qualität der Bilder bin ich ebenfalls sehr begeistert.
Diese Sofortbildkamera ist wirklich für jeden geeignet. Fotografen, die ein wenig mit Funkionen, wie Langzeitbelichtung oder Doppelbelichtung, spielen möchten, aber auch für ""Anfänger"", da die Standardeinstellungen schon tolle Bilder liefern!; J'adore la photo et j'ai globalement suivi l'évolution du marché depuis le milieu des années 90 : les appareils argentiques jetables de mon enfance, les compacts numériques, une montée en gamme en passant au bridge puis au reflex, sans compter les smartphones toujours plus performants. Résultat : des milliers, peut-être des dizaines de milliers de photos qui dorment dans des disques durs, des clés usb... et que je ne regarde jamais ou presque.

L'instax, malgré son aspect plastique cheap en main, malgré ses caractéristiques médiocres sur le papier (un 60 mm f/12,7) procure le plaisir unique de l'instantané et de la photo qui se dessine peu à peu sous vos yeux. Elle devient tout de suite un objet tangible qui crée du lien, et même une émotion liée à son imperfection (à la manière d'un vinyle). Car le but n'est pas d'égaler la précision des appareils numériques mais de créer des photos plus authentiques, dans un style très vintage. Les maniaques du piqué, passez votre chemin : oui il y aura du flou, de la surexposition, des photos complètement loupées... mais c'est aussi le jeu. Et ce doit être compliqué pour quelqu'un qui n'a jamais connu l'argentique. Il faut vraiment gérer la lumière et ne pas chercher des compositions trop compliquées avec de trop fortes dynamiques : c'est voué à l'échec. Mais on apprend et si on se fait avoir au début, on sort ensuite des clichés plus satisfaisants avec beaucoup de charme.

De plus, l'instax mini 99 constitue une évolution par rapport aux autres modèles et propose un peu plus de contrôle sur les photos : les filtres de couleur, le réglage de la luminosité, le vignetage, 3 niveaux de mise au point, le contrôle du flash, plusieurs modes (intérieur, sport, double exposition, bulb). Cela décuple les possibilités créatives !

Bref, oubliez la technique trop compliquée, oubliez les smartphones qui corrigent trop et profitez d'un appareil à mi-chemin entre la tradition et la modernité qui vous redonnera le sourire.; Vraiment un immense plaisir à utiliser !; it is easy to use，vantage style. but It doesn't look as good as the Mini 90. The improvement over the Mini 90 is not significant, and the price might be a bit high. Personally, I think a reasonable price for this machine would be around $150.; The newest of Fuji's Instax range the 99 is a big bulky camera that uses the standard Instax film (it doesn't come with any film so I bought a pack for use with the camera). As with other Instax cameras it doesn't offer the option to print borderless unlike the Kodak Mini Shot range. It features macro & landscape capabilities (accessed by turning the lens) as well light/darkness compensation. I didn't use the camera with the App as I feel the camera should be able to do what I want in camera. The advertising tends to emphasise the novelty features (colour effects, vignetting etc) .
Having tried it on macro I found that when using flash it would focus past the subject. Without flash it struggled with image definition and tended to wash out details.
When taking shots outside (see attached photograph) it struggled with definition and contrast. The first of the three photos was taken on ""N"" and then using the light/darkness compensation dial for the last two. The shots are either too bright or too dark (the sun was behind and to the side).
Overall picture quality is variable (out of twenty shots there wasn't one that was particularly good), the camera build is plastic and bulky and I feel is overpriced."
Fujifilm Instax Wide 300 Instant Camera- WHITE,"6,999",https://www.amazon.in/sspa/click?ie=UTF8&spc=MTo1ODI2NjQzMzEwNDQ4MTc1OjE3MTkyMTQ3NTE6c3BfYXRmOjIwMDk2NjEwNzg4ODk4OjowOjo&url=%2FFujifilm-Instax-Wide-Instant-Camera%2Fdp%2FB085893CCH%2Fref%3Dsr_1_2_sspa%3Fcrid%3D4JBM3GA1T7F5%26dib%3DeyJ2IjoiMSJ9.X0BDLWsnuDGIJWy5e5VTQZSQ-Zo6YHRSQjpLBytpQogRqjKvaWaw6yy8Ptzmxvrh3U-VGJnXhczGx1Uz2efO8u5_KjyevthnrJj4pc4dYnZK0SEegi7hbde71RDIqPZXBHG9U7Q_iwxA1mOLj_JF_VMD_-FKCO9tbxMpXLOokwJIa3e1HV-EMVH0HszXhUP8o9OfVP0EgKKGwJQ4J75KJ1adQORgioPYefS4KkYpiEk.3tgCh6JQMEGzVW65k93AMNw6TLfd4QVOanNzn39j1M0%26dib_tag%3Dse%26keywords%3Dold%2Banalog%2Bfilm%2Bcameras%26qid%3D1719214751%26sprefix%3Dold%2Banalog%2Bfilmcameras%252Caps%252C213%26sr%3D8-2-spons%26sp_csd%3Dd2lkZ2V0TmFtZT1zcF9hdGY%26psc%3D1,https://m.media-amazon.com/images/I/61mflhdLssL._SX355_.jpg,"The Fujifilm instax WIDE 300 is our largest format instax camera; Built in flash & fill in flash mode; Film size 108 (w) x 86 (H) cm. Twice as wide as instax mini film; Improved ease of use of the camera includes a tripod socket, focal zoom dial and user friendly interface; Two mode focusing, normal (0.9 m-3 m) and landscape (3 m plus); Programmed electronic shutter release, 1/64 sec - 1/200 sec","I love this camera. I was torn between this and the fuji mini 90 neo. But I am glad i chose this one. I love wide films and the pictures come out very well. The facial features and the background etc are clearly visible. My sister has the fuji neo, and though it is better looking, the pictures are so small. And definitely not worth a memory
This camera has a plastic feel to it but its durable. Selfies however do not come out that well with this camera. It doesn't have many features, but it's definitely worth a buy. I have bought 8 films upto now and i love using it.; Good camera ,its wide ,aesthetic but the film is not available abundantly; It appears there are concerns about the camera's bulkiness, malfunctioning lens, and limited exchange policies specifically for damaged bodies, with no consideration for other issues and no overall return policy, only allowing exchanges; I liked the easy operation of loading and taking the photos. In bright sunlight, I suggest to use the darken mode. Photos are clear and colours, vivid and accurate. Against a white background, photos tend to overexpose. Selfie, close up mirror is easy to attach. Landscape photos are the most accurate and pleasing.; It is a great thing to carry while travelling.
Pros:
- sturdy
- simple mechanism
- great puctures in daylight
- instant giveaways to people you meet

Cons
- bulky size, more than an avg DSLR
- pictures with flash tend to be devoid of info, background is often lost in it
- inability to work well in dim light
- expensive films, each picture costs around 55INR.

Having said that, i personally enjoy owning this camera. It is bulky as compared to Instax mini models but the picture size is definately substantial and gives a feeling of nostalgia (I owed a Mini 70). It is departure from the 100 pictures we take from the phone and barely ever look back to.; Amazing ! Amazing! Amazing camera! Fabulous features with light mode adjustments. It’s value is even quite in the range for people.I got it during the amazon sale period for really cheap! It's really worth buying coz this one gives you bigger proportionate pictures unlike the small ones. It’s quite simple to use and gives the most fabulous results in open areas. The quality of the picture is also without a doubt really good. I have had previous experiences with polaroid camera but this one is by far the best I have come across. It's really great choice for people who wish to buy a Polaroid camera; As an moderately experienced photographer owning a DSLR and an SLR, having an instant camera was just for fun and the instax wide 300 is a great buy if you just want to have some fun. However if you’re looking to get creative with this particular model of the instax line up, you’ll be let down. It doesn’t even have a timer.
I personally never found myself needing the timer, but for those of you who do will have to look for something else.
In the film cartridge department, the wide cartridges are quite limited for now and as it seems they don’t look like they are going to introduce any new fun cartridges.; At first I really enjoyed the wide shots and the picture quality was decent. Eventually after a couple of uses it just stopped working. No idea why,; I looove the Polaroid wide3000. Packaged neatly, came in perfect condition. Works fine, love that it came with the selfie attachment as well. Tried it as soon as I opened it, I was so excited. Only tricky part was figuring out how to attach the neck attachment. Would definitely recommend buying; Got this from my daughter. She loves it. Has a lot of fun with it. So far so good.; La compre como regalo y no le fue difícil a quién la recibió aprender a usarla, además que toma muy buenas fotos con el toque vintage que le da al ser instantáneas.; Há tempos queria uma máquina de foto instantânea e a escolha foi perfeita! Maior foto de todas as existentes! Tem uma lente com espelho para selfie. Único ponto negativo: o manual não tem língua portuguesa, mas tem espanhol.; Buenísimo cámara de foto instantánea, fue un regalo para mi hija. Inicialmente compré otra cámara de otra marca muy conocida, pero no nos gustó nada las fotos que hacia, eran de mala calidad así que juntos decidimos cambiarla por esta Instax Wide. Y el cambio fue todo un acierto: esta cámara hace unas fotos de una calidad más que aceptable. Buena resolución y buena luz. Como contras diría que el papel no es barato, y que funciona con pilas desechables, no se puede cargar, lo que no es nada ecológico. Aún así, recomiendo su compra si quieres disfrutar de unas fotos instantáneas chulas."
"Ilford SPRITE35-ii Film Camera Black and Silver, Full-Size","4,151",https://www.amazon.in/Ilford-SPRITE35-ii-Camera-Silver-Full-Size/dp/B08XSX6Z9J/ref=sr_1_3?crid=4JBM3GA1T7F5&dib=eyJ2IjoiMSJ9.X0BDLWsnuDGIJWy5e5VTQZSQ-Zo6YHRSQjpLBytpQogRqjKvaWaw6yy8Ptzmxvrh3U-VGJnXhczGx1Uz2efO8u5_KjyevthnrJj4pc4dYnZK0SEegi7hbde71RDIqPZXBHG9U7Q_iwxA1mOLj_JF_VMD_-FKCO9tbxMpXLOokwJIa3e1HV-EMVH0HszXhUP8o9OfVP0EgKKGwJQ4J75KJ1adQORgioPYefS4KkYpiEk.3tgCh6JQMEGzVW65k93AMNw6TLfd4QVOanNzn39j1M0&dib_tag=se&keywords=old+analog+film+cameras&qid=1719214751&sprefix=old+analog+filmcameras%2Caps%2C213&sr=8-3,https://m.media-amazon.com/images/I/61CW20P7jyL._SY450_.jpg,"Camera Type: Ilford Sprite 35-II Camera meets the needs of people experimenting with 35mm film and looking for a camera that’s 'no frills' simple. It’s a step up from disposable cameras, and being re-usable, it won’t create extra waste; Lens: The camera has a fixed shutter speed (1/120s) with a 31mm, single element f/9 fixed-focus wide-angle lens, perfect for capturing most well-focused daylight scenes; Built-In Flash: It also features a built-in flash with a 15-second recycle time for night time shooting; Film Compatibility: Users can load the Sprite 35-II with their favorite film, whether its color negative or black and white, allowing them to capture quick snapshots or moody monochrome scenes; Film Handling: The camera has a manual film advance winding lever to move through each exposure and rewind the roll when the film is finished; Compatible Mountings: Micro Four Thirds","; Bought one for myself for travel but wanted an easy point and shoot.; Matched with hp5+, fun little little camera for candids around the house.; رائع; Horror, se pilla el carrete; Nach einem Film hat das mechanische Dreh-Rad, um das neue bild in position zu bringen geklemmt. 50euro für die Katze :( Es hätte so schön sein können."
"Ilford SPRITE35-ii Film Camera Black, Full-Size","4,597",https://www.amazon.in/Ilford-SPRITE35-ii-Camera-Black-Full-Size/dp/B08X1HCTRB/ref=sr_1_4?crid=4JBM3GA1T7F5&dib=eyJ2IjoiMSJ9.X0BDLWsnuDGIJWy5e5VTQZSQ-Zo6YHRSQjpLBytpQogRqjKvaWaw6yy8Ptzmxvrh3U-VGJnXhczGx1Uz2efO8u5_KjyevthnrJj4pc4dYnZK0SEegi7hbde71RDIqPZXBHG9U7Q_iwxA1mOLj_JF_VMD_-FKCO9tbxMpXLOokwJIa3e1HV-EMVH0HszXhUP8o9OfVP0EgKKGwJQ4J75KJ1adQORgioPYefS4KkYpiEk.3tgCh6JQMEGzVW65k93AMNw6TLfd4QVOanNzn39j1M0&dib_tag=se&keywords=old+analog+film+cameras&qid=1719214751&sprefix=old+analog+filmcameras%2Caps%2C213&sr=8-4,https://m.media-amazon.com/images/I/61kXTHmSOeL._SY355_.jpg,"Camera Type: Ilford Sprite 35-II Camera meets the needs of people experimenting with 35mm film and looking for a camera that’s 'no frills' simple. It’s a step up from disposable cameras, and being re-usable, it won’t create extra waste; Lens: The camera has a fixed shutter speed (1/120s) with a 31mm, single element f/9 fixed-focus wide-angle lens, perfect for capturing most well-focused daylight scenes; Built-In Flash: It also features a built-in flash with a 15-second recycle time for night time shooting; Film Compatibility: Users can load the Sprite 35-II with their favorite film, whether its color negative or black and white, allowing them to capture quick snapshots or moody monochrome scenes; Film Handling: The camera has a manual film advance winding lever to move through each exposure and rewind the roll when the film is finished","Convenient and fun way to take photos.; Me gusto es fácil e intuitivo, aún no revelo aún me queda disparos en el rollo; I bought this camera so excited to take it on my trip to the Philippines and it never lets me load the film, it doesn't let you load the film. When I finally loaded it, thinking it was working, I starter taking pictures and nothing has come out of it. I am so disappointed. Save your money and invest in something better than this.; Leggera; Kamera ist genau wie erwartet, knipsen zum ganz kleinen, zum mini Preis. (gilt nur für Kamera)"
"KODAK EKTAR H35 Half Frame Film Camera, 35mm, Reusable, Focus-Free, Lightweight, Easy-to-Use (Sage) (Film & AAA Battery are not Included)","8,132",https://www.amazon.in/KODAK-Reusable-Focus-Free-Lightweight-Included/dp/B0B1J582SJ/ref=sr_1_5?crid=4JBM3GA1T7F5&dib=eyJ2IjoiMSJ9.X0BDLWsnuDGIJWy5e5VTQZSQ-Zo6YHRSQjpLBytpQogRqjKvaWaw6yy8Ptzmxvrh3U-VGJnXhczGx1Uz2efO8u5_KjyevthnrJj4pc4dYnZK0SEegi7hbde71RDIqPZXBHG9U7Q_iwxA1mOLj_JF_VMD_-FKCO9tbxMpXLOokwJIa3e1HV-EMVH0HszXhUP8o9OfVP0EgKKGwJQ4J75KJ1adQORgioPYefS4KkYpiEk.3tgCh6JQMEGzVW65k93AMNw6TLfd4QVOanNzn39j1M0&dib_tag=se&keywords=old+analog+film+cameras&qid=1719214751&sprefix=old+analog+filmcameras%2Caps%2C213&sr=8-5,https://m.media-amazon.com/images/I/711seEoUM9L._SX466_.jpg,"📷 Film-saving: You can have twice as many images per roll. For example, a film roll with 36 exposures can yield around 72 half-frame photos - doubled!; 📷 Lightweight and Easy-to-use: The pocket-size camera is light and tiny, and hence convenient for you to bring along daily. Since its instructions are simple, it is suitable for all analog hobbyists.; 📷 Built-in Flash: Turning on the flash by adjusting the silver ring around the lens so that you can use KODAK EKTAR H35 during days and nights, outdoor and indoor.; 📷 Four colours: Black, brown, sage and sand. Neat and natural.; 📷 Perfect for Beginners: The point-and-shoot camera is easy to use for new analogue hobbyists.","La regalé a mi pareja y la llevamos a todos los viajes, es muy ligera y fácil de usar, y las fotos salen preciosas! Estoy muy feliz con la compra. Al ser de doble exposición se ahorra mucho en rollos. Me encanta!; I bought this to take with me on a Europe trip. I wasted a couple shots at the beginning of the roll because the counter isn't super clear when it starts, but not a huge deal; you get 72 vertical shots per roll of 35mm film. I used Kodak Color Plus 200 ISO & am happy I went with that ISO. This camera does not do well in low-light--it couldn't capture a brightly lit Eiffel Tower. It does have flash option, but I opted not to use it.

This camera is compact & light enough that I was able to have it in my cross-body bag along with my phone, passport/wallet, & portable battery along with a few other random things. It survived 5 countries and a week of train travel! I prefer shooting with natural light & I think this camera + film selection was great for getting those types of compositions.

I did not opt for prints when I got the roll developed, but it was a little bit more for development & scanning since it's a half-frame camera. I got 72 4x6 shots on one roll. These photos will be portrait by default, the opposite of a regular camera.; I've gone through my fair share of point-and-shoot cameras and this one has been the best by far. While it is made of plastic and therefore feels a bit cheap, it still does the trick and has lasted longer than any of my other plastic cameras.

The best part, however, is that it takes 2 photos per film frame which means you get double the amount of photos. 36 exposures = 72 pictures. film is expensive these days so this is something I can really appreciate.

No complaints over here! Happy customer; Schöne, handliche Retrokamera mit super BIldqualität.
Ich habe die Kamera anstatt einer Sofortbildkamera gewählt, weil sie viel handlicher ist.
Das kleine Format macht es besonders attraktiv.
Super um schöne Momente festzuhalten!

Die Filme sind jedoch recht teuer, muss es einem schon wert sein.; Facil de usar"
"KODAK EKTAR H35 Half Frame Film Camera, 35mm, Reusable, Focus-Free, Lightweight, Easy-to-Use (Brown) (Film & AAA Battery are not Included)","9,283",https://www.amazon.in/KODAK-Reusable-Focus-Free-Lightweight-Included/dp/B0B1J7SPTP/ref=sr_1_6?crid=4JBM3GA1T7F5&dib=eyJ2IjoiMSJ9.X0BDLWsnuDGIJWy5e5VTQZSQ-Zo6YHRSQjpLBytpQogRqjKvaWaw6yy8Ptzmxvrh3U-VGJnXhczGx1Uz2efO8u5_KjyevthnrJj4pc4dYnZK0SEegi7hbde71RDIqPZXBHG9U7Q_iwxA1mOLj_JF_VMD_-FKCO9tbxMpXLOokwJIa3e1HV-EMVH0HszXhUP8o9OfVP0EgKKGwJQ4J75KJ1adQORgioPYefS4KkYpiEk.3tgCh6JQMEGzVW65k93AMNw6TLfd4QVOanNzn39j1M0&dib_tag=se&keywords=old+analog+film+cameras&qid=1719214751&sprefix=old+analog+filmcameras%2Caps%2C213&sr=8-6,https://m.media-amazon.com/images/I/81Myocy5MXL._SX466_.jpg,"📷 Film-saving: You can have twice as many images per roll. For example, a film roll with 36 exposures can yield around 72 half-frame photos - doubled!; 📷 Lightweight and Easy-to-use: The pocket-size camera is light and tiny, and hence convenient for you to bring along daily. Since its instructions are simple, it is suitable for all analog hobbyists.; 📷 Built-in Flash: Turning on the flash by adjusting the silver ring around the lens so that you can use KODAK EKTAR H35 during days and nights, outdoor and indoor.; 📷 Four colours: Black, brown, sage and sand. Neat and natural.; 📷 Perfect for Beginners: The point-and-shoot camera is easy to use for new analogue hobbyists.","La regalé a mi pareja y la llevamos a todos los viajes, es muy ligera y fácil de usar, y las fotos salen preciosas! Estoy muy feliz con la compra. Al ser de doble exposición se ahorra mucho en rollos. Me encanta!; I bought this to take with me on a Europe trip. I wasted a couple shots at the beginning of the roll because the counter isn't super clear when it starts, but not a huge deal; you get 72 vertical shots per roll of 35mm film. I used Kodak Color Plus 200 ISO & am happy I went with that ISO. This camera does not do well in low-light--it couldn't capture a brightly lit Eiffel Tower. It does have flash option, but I opted not to use it.

This camera is compact & light enough that I was able to have it in my cross-body bag along with my phone, passport/wallet, & portable battery along with a few other random things. It survived 5 countries and a week of train travel! I prefer shooting with natural light & I think this camera + film selection was great for getting those types of compositions.

I did not opt for prints when I got the roll developed, but it was a little bit more for development & scanning since it's a half-frame camera. I got 72 4x6 shots on one roll. These photos will be portrait by default, the opposite of a regular camera.; I've gone through my fair share of point-and-shoot cameras and this one has been the best by far. While it is made of plastic and therefore feels a bit cheap, it still does the trick and has lasted longer than any of my other plastic cameras.

The best part, however, is that it takes 2 photos per film frame which means you get double the amount of photos. 36 exposures = 72 pictures. film is expensive these days so this is something I can really appreciate.

No complaints over here! Happy customer; Schöne, handliche Retrokamera mit super BIldqualität.
Ich habe die Kamera anstatt einer Sofortbildkamera gewählt, weil sie viel handlicher ist.
Das kleine Format macht es besonders attraktiv.
Super um schöne Momente festzuhalten!

Die Filme sind jedoch recht teuer, muss es einem schon wert sein.; Facil de usar"
"Analog Disposable Camera w/Flash + Development & Digital Uploads (Red) | 35mm Film Single-Use Camera, 24 Exposures, Pictures Sent to Your Phone","6,383",https://www.amazon.in/Disposable-Development-Single-Use-Exposures-Pictures/dp/B0994V78JV/ref=sr_1_7?crid=4JBM3GA1T7F5&dib=eyJ2IjoiMSJ9.X0BDLWsnuDGIJWy5e5VTQZSQ-Zo6YHRSQjpLBytpQogRqjKvaWaw6yy8Ptzmxvrh3U-VGJnXhczGx1Uz2efO8u5_KjyevthnrJj4pc4dYnZK0SEegi7hbde71RDIqPZXBHG9U7Q_iwxA1mOLj_JF_VMD_-FKCO9tbxMpXLOokwJIa3e1HV-EMVH0HszXhUP8o9OfVP0EgKKGwJQ4J75KJ1adQORgioPYefS4KkYpiEk.3tgCh6JQMEGzVW65k93AMNw6TLfd4QVOanNzn39j1M0&dib_tag=se&keywords=old+analog+film+cameras&qid=1719214751&sprefix=old+analog+filmcameras%2Caps%2C213&sr=8-7,https://m.media-amazon.com/images/I/71i4iioH8BL._SY450_.jpg,"STRESS-FREE DEVELOPMENT: Don't waste time going to a pharmacy for film development. Use our pre-paid mailer and let us handle the rest!; SUPER SHAREABLE: Finally get digital scans of your film sent directly to your phone for easy downloading and sharing.; UNIQUE DESIGNS: We bring you four unique designs that are sure to stand out in a crowd. Get ready for people asking where you got them!; A BETTER DISPOSABLE: Analog cameras are fun, easy and affordable. They're the perfect way to get more out of trips, events and life in general!; IN-HOUSE PROCESS: Disposables and development have traditionally been separate businesses. Bringing it all in house allows us to cut costs and pass those savings on to you!; SUSTAINABLE FOCUS: We recycle every camera and are putting every dollar earned into making the hobby more environmentally friendly.",
"KODAK EKTAR H35N Half Frame Film Camera, 35mm, Reusable, Focus-Free, Bulb Function, Built-in Star Filter, Coated Improved Lens (Film & AAA Battery are not Included) (Striped Silver)","11,166",https://www.amazon.in/KODAK-Reusable-Focus-Free-Function-Improved/dp/B0CBBT55VK/ref=sr_1_8?crid=4JBM3GA1T7F5&dib=eyJ2IjoiMSJ9.X0BDLWsnuDGIJWy5e5VTQZSQ-Zo6YHRSQjpLBytpQogRqjKvaWaw6yy8Ptzmxvrh3U-VGJnXhczGx1Uz2efO8u5_KjyevthnrJj4pc4dYnZK0SEegi7hbde71RDIqPZXBHG9U7Q_iwxA1mOLj_JF_VMD_-FKCO9tbxMpXLOokwJIa3e1HV-EMVH0HszXhUP8o9OfVP0EgKKGwJQ4J75KJ1adQORgioPYefS4KkYpiEk.3tgCh6JQMEGzVW65k93AMNw6TLfd4QVOanNzn39j1M0&dib_tag=se&keywords=old+analog+film+cameras&qid=1719214751&sprefix=old+analog+filmcameras%2Caps%2C213&sr=8-8,https://m.media-amazon.com/images/I/81rB-5ceQ3L._SY355_.jpg,"✨ Built-in Star Filter: Photographs tiny light sources to create a four-beam flare on light spots.; 🔍 Coated, Improved Glass Lens: One element of glass lens sharpens the clarity of the images.; 💡 Bulb Function (Long Exposure): Helps to capture the trail of moving objects, mostly at night.; 📷 Tripod Hole: Uses a tripod to keep your camera steady to support long exposure photography.; ⚠️ Film, AAA battery, cable release and tripod are not included with the product.","Es increíble y retroKul pero saca tomas muy sub expuestas x lo que necesitas flash casi siempre; It’s such a very beautiful and unique camera. I love that it’s small doesn’t need to much space, it’s so light and perfect for any occasion to make some memories.; Hace tiempo quería una cámara analógica y me encontré muy buenas reseñas de esta, la verdad que es fácil de usar, aún no he revelado las fotos así que no se como han quedado, pero en general es buen producto; おもちゃな感じのカメラですが、ちゃんと写ります。（KodakのISO200フィルム使用）
前作のH35に比べフィルターなどを使用出来るのも良い感じです。; Must have even for experienced photographer like myself. Compact, double the quantity of shots, well-made, super light."
