Title,Price,Link,Image URL,Description,Reviews
"Samsung Galaxy Tab S6 Lite 26.31 cm (10.4 inch), S-Pen in Box, Slim and Light, Dolby Atmos Sound, 4 GB RAM, 64 GB ROM, Wi-Fi Tablet, Gray","22,999",https://www.amazon.in/sspa/click?ie=UTF8&spc=MTo1MTI5Mzg4NTA5MzYxNzQ6MTcxOTE3MjY0MjpzcF9zZWFyY2hfdGhlbWF0aWM6MjAxMTAzNDE1NDU5OTg6OjA6Og&url=%2FSamsung-Galaxy-26-31-S-Pen-Tablet%2Fdp%2FB0B3JK8YQW%2Fref%3Dsxin_15_pa_sp_search_thematic_sspa%3Fcontent-id%3Damzn1.sym.ee635213-fee1-408a-be4a-3523feeb9a42%253Aamzn1.sym.ee635213-fee1-408a-be4a-3523feeb9a42%26crid%3D3EKUOWI4I0TPH%26cv_ct_cx%3Dandroid%2Btablet%26dib%3DeyJ2IjoiMSJ9.9aE_WbRtjYZT2BkotcmvxqZertFF_xqxdXh7DKtk804Z19b5ZGJWseXqcFV5yKPc2KkaTCwz4jrq8fL0PRBZAA.G7dTy3e9pM1m6Cn-4MPZXG_MrKvcnA2W7qVCm8hLLLU%26dib_tag%3Dse%26keywords%3Dandroid%2Btablet%26pd_rd_i%3DB0B3JK8YQW%26pd_rd_r%3De37d63d7-c9fb-4db3-ac30-ea9a85086bc9%26pd_rd_w%3DLxzve%26pd_rd_wg%3DsMp90%26pf_rd_p%3Dee635213-fee1-408a-be4a-3523feeb9a42%26pf_rd_r%3DGTHMENY49KZ61J8WX2ST%26qid%3D1719172642%26sbo%3DRZvfv%252F%252FHxDF%252BO5021pAnSA%253D%253D%26sprefix%3Dandroid%2Btablet%252Caps%252C251%26sr%3D1-1-ced4eeeb-b190-41d6-902a-1ecb3fb8b7c4-spons%26sp_csd%3Dd2lkZ2V0TmFtZT1zcF9zZWFyY2hfdGhlbWF0aWM%26psc%3D1,https://m.media-amazon.com/images/I/61vsK7h3zVL._SX450_.jpg,"Samsung Galaxy S6 Lite Display: 26.31cm (10.4"") display size| TFT display screen | 60Hz display | 16M colour support | Metal Uni-body | Slim and lightweight; Galaxy S8 Tab Processor: Octa-Core processor type |Network/Bearer : 4G, Operating system: Android 12. Battery Capacity: 7,040mAh (typical) Battery; Samsung Galaxy Tab S6 Lite Camera: 8MP Rear Camera | 5MP Front Camera | Video Recording with FHD (1920 x 1080)@30fps Resolution; Safety feature: Multi-layered Samsung Knox security platform. Audio Experience: Dual speakers | AKG | Dolby Atmos 3D surround sound. S Pen Support: Yes; Warranty: 1 year manufacturer warranty for the device and 6 months manufacturer warranty for in-box accessories, including batteries, from the date of purchase; Samsung Galaxy S6 Lite Display: 26.31cm (10.4"") display size| TFT display screen | 60Hz display | 16M colour support | Metal Uni-body | Slim and lightweight;Galaxy S8 Tab Processor: Octa-Core processor type |Network/Bearer : 4G. Physical specification: Weight only 467g | 244.5 x 154.3 x 7.0 Dimension; Battery Capacity: 7,040mAh (typical) Battery;Samsung Galaxy Tab S6 Lite Camera: 8MP Rear Camera | 5MP Front Camera | Video Recording with FHD (1920 x 1080)@30fps Resolution","Though I've stopped writing detailed reviews due to lack of time, I just had to write this one. Firstly, a big thanks to Amazon for hassle free exchange and delivery on time! And seller Appario retail once again has impressed me with their quality service.
Coming to the tablet, it's hands down the best there is at the budget range.
Screen- 8/10 As good as a TFT panel can be, bright enough and vibrant enough. It's no AMOLED but it's great. I didn't listen to the bad reviews, thankfully. There's no light bleed on my unit, as so many have said. Maybe they've fixed the issue. I had a Galaxy Tab 10.1 with a very good display. The contrast level is much better here. Viewing angles could have been little better though.
Processor- 8/10 I think nobody's buying this tablet to seriously pursue heavy gaming. For the regular user, the updated SD720G is a very snappy processor. No lags or jitters. I've worked with drawing apps and Rough Animator without any issues at all. RAM plus takes care of multitasking and app management.
Battery- good enough to last a day of use. Depends what kind of user you are, for average user it'll last more than a day. Expect SOT of 7-8 hrs at least! Just video streaming can last for 10-11 hrs at medium brightness!
S-PEN- 10/10 The reason why most people will be buying this tablet, and it will not disappoint. It takes the whole experience to a different level. Works like a charm, Samsung has fine tuned it over so many years. Worth it!
Software- 10/10 Samsung IS the most evolved Android UI there is at the moment. And they have optimised it for tablet. So many features like multi windows, gestures, air command and their integrated ecosystem and features like Samsung Dex work seamlessly for work user experience. Plus Samsung is exceptional nowadays with updates.
So my experience with this tablet is awesome and it's the best there is at this range. Period. Some other manufacturers like Lenovo,Realme etc may seemingly give you more bang for the same cost. But nothing can match the overall experience.
Overall 8.5/10
Value for money- 10/10 as the s-pen is included!; I recently purchased the Samsung Galaxy Tab S6 Lite during a great summer offer, and at the price of 14k, it's hard to find fault with. It's an ideal choice for professionals needing it for office use, students looking to take notes, and beginner artists.

In terms of performance, I found it to be quite efficient for everyday tasks. However, at its regular pricing, I would complain that it shows some lag when multitasking. The sound quality is good, but it could be louder for a more immersive entertainment experience. Overall, considering its current price, the Galaxy Tab S6 Lite is a worthwhile investment for those seeking a versatile and affordable tablet; If you are a student or a working professional and need to take notes or create slides, this is what you need. Value for money and under 25k budget this is the best buy.
Fast charging. Screen size is quite good to watch youtube videos, with a quite decent RAM it provides smoothness. And my favourite part is the pen.; Love this tablet, it isn't super powerful like my phone but it's still more fun to use the tablet, and the S pen it's fantastic; S pen working very well.overall satisfied with it performance. camera quality is not too good, overall I can say in this price range good tablet; The Samsung Galaxy Tab S6 Lite is a great tablet for students who are looking for a device that can handle both study and productivity tasks. It comes with an S Pen stylus that is included in the box, which makes it easy to take notes, draw, and annotate documents. The stylus also attaches magnetically to the side of the tablet, so you don't have to worry about losing it.

The tablet has a 10.4-inch TFT display that is bright and sharp, with good viewing angles and colors. The screen size is ideal for watching videos, reading e-books, and browsing the web. The tablet also has dual speakers that are tuned by AKG, which deliver clear and loud sound quality.

The tablet is powered by an snapdragon processor, which is capable of handling most apps and games smoothly. The tablet also has 4GB of RAM and 64GB or 128GB of internal storage, which can be expanded with a microSD card. The battery life is impressive, as the tablet can last for up to 12 hours of video playback on a single charge.

The tablet has a sleek and premium design, with a metal back and thin bezels. It is available in three colors: Angora Blue, Oxford Gray, and Chiffon Pink. The tablet is also lightweight and slim, making it easy to carry around.

The tablet runs on Android 13 with One UI on top, which offers a lot of customization options and features. The tablet also supports Samsung DeX mode, which allows you to connect the tablet to a monitor or TV and use it as a desktop PC. The tablet also has some useful apps pre-installed, such as Samsung Notes, Samsung Kids, and Netflix.

The only drawbacks of the tablet are that it does not have an AMOLED display, which would have offered better contrast and colors; it does not have a fingerprint scanner or face unlock, which would have made it more secure; and it does not have a keyboard cover accessory, which would have made it more productive. The s Pen is the magic wand 🪄 but it's tip got damaged only after 4 days of use....

Overall, the Samsung Galaxy Tab S6 Lite is a fantastic tablet for students who want a versatile device that can handle both study and productivity tasks. It offers a good display, a powerful performance, a long battery life, a premium design, and an S Pen stylus that is included in the box. It is also priced reasonably compared to other tablets in the market. The Samsung Galaxy Tab S6 Lite is definitely a must-buy for students who are looking for a tablet that can do it all.
i got this tab @14999 @ amazon great indian sell and card discount....; 1) Snapdragon processer is superb
Day to day task & productivity is superb.
2) Battery life is good.
3) Touch response is bit slow.
4) Stylus pen is superb
5) supports fast charging
6) Dual AKG Speakers produce amazing quality of sound.; really mice product at this price range ( i got it for aound 17 during sales but its pen quality is realy superb i use it to make my notes and edit pdfs and lectures and i can tell u that it Provides u a smooth writing experience ..so go for it if u want to use it for educational purposes and some light office use..been using microsoft 365 also."
"Samsung Galaxy Tab A9+ 27.94 cm (11.0 inch) Display, RAM 8 GB, ROM 128 GB Expandable, Wi-Fi Tablet, Graphite","19,999",https://www.amazon.in/sspa/click?ie=UTF8&spc=MTo1MTI5Mzg4NTA5MzYxNzQ6MTcxOTE3MjY0MjpzcF9zZWFyY2hfdGhlbWF0aWM6MzAwMTIwMTk0ODM4NDMyOjozOjo&url=%2FSamsung-Galaxy-Tab-A9-Expandable%2Fdp%2FB0CJ38X1BQ%2Fref%3Dsxin_15_pa_sp_search_thematic_sspa%3Fcontent-id%3Damzn1.sym.ee635213-fee1-408a-be4a-3523feeb9a42%253Aamzn1.sym.ee635213-fee1-408a-be4a-3523feeb9a42%26crid%3D3EKUOWI4I0TPH%26cv_ct_cx%3Dandroid%2Btablet%26dib%3DeyJ2IjoiMSJ9.9aE_WbRtjYZT2BkotcmvxqZertFF_xqxdXh7DKtk804Z19b5ZGJWseXqcFV5yKPc2KkaTCwz4jrq8fL0PRBZAA.G7dTy3e9pM1m6Cn-4MPZXG_MrKvcnA2W7qVCm8hLLLU%26dib_tag%3Dse%26keywords%3Dandroid%2Btablet%26pd_rd_i%3DB0CJ38X1BQ%26pd_rd_r%3De37d63d7-c9fb-4db3-ac30-ea9a85086bc9%26pd_rd_w%3DLxzve%26pd_rd_wg%3DsMp90%26pf_rd_p%3Dee635213-fee1-408a-be4a-3523feeb9a42%26pf_rd_r%3DGTHMENY49KZ61J8WX2ST%26qid%3D1719172642%26sbo%3DRZvfv%252F%252FHxDF%252BO5021pAnSA%253D%253D%26sprefix%3Dandroid%2Btablet%252Caps%252C251%26sr%3D1-4-ced4eeeb-b190-41d6-902a-1ecb3fb8b7c4-spons%26sp_csd%3Dd2lkZ2V0TmFtZT1zcF9zZWFyY2hfdGhlbWF0aWM%26psc%3D1,https://m.media-amazon.com/images/I/61afkty1foL._SY450_.jpg,"Outstanding vividness with 27.94 cm (11.0 ) LCD display, 90 Hz Refresh Rate, 1920 x 1200 (WQXGA); Qualcomm Snapdragon SM6375 Processor; 8 MP AF Rear Camera, 5 MP FF Front camera,Quad Speakers Surround Sound; 7040 mAh Battery; Memory Storage Capacity: 128.0GB; Ram Memory Installed Size: 8.0GB; Battery Capacity: 7040.0 mAH; Special Features: Fast Charging","Like the A9 plus wify tab verymuch !
Great 11 inch display, i did not feel any lag ever during my office activities of reading pdf, powerpoint, seeing videos and mp4. I do not do gaming.
Lound ,crystal clear sound with spatial distinction, supports dolby .
Has bluetooth and also headphone jack.
Side slot for microSD card upto 1 TB. My wify model does not support sim.
Those who have bought wify+sim suppport, the side slot supports microSD card and sim.
Usual Samsung One UI ...very convenient and easy to switch contacts, sms, downloads etc. Also logging in and setting up the tab using my another samsung phone was super easy and headache free. Also the Quallcom Snapdragon processor is reliable and heavy duty proof.
Dislike...
The main camera in rear is mediocre. Compared to such great device, configuration and display support ,this camera is just plain ordinary without much features.; This is awesome tablet. Very fast and battery life is good too. Highly satisfied with the purchase. I got this on offer for less than 13k in May 24.; Pros:
8 gb Ram..nice speed no lags..
No heating issue even when playing or charging.
Good big sound.
Good resolution..1080 p youtube videos
Good for reading..eyeshield..feature..screen size is big enough for a book page to fit comfirtably..this is what I wanted..
Con:
Battery is drying up even when I am reading only..in one day..every night I need to charge..my previous tab ..samsung 2 gb used to afford me more battery..but given 8gb speed its understandable..
If your requirement is only reading..better go with s6 lite 4 gb which also comes with pencil. But you want some multimedia n games too..then in this price range this one is best with 8gb RAM.
I am a happy customer. 5 out of 5 stars.; 1)First of all the seal was broken.
2) I found glues are shown between screen and body on all sides of the tab,which looks like a repaired one.
3)Month and Year in the box is showing March 2024 but I found so many screen shots in image folder, whose created date is showing Nov 2023.
4)There is no temporary screen guard on the screen as new phones or tabs usually have.; I got this at a very low price of 14k so it is a value for money amazing speaker quality good screen size for this price point; Has most of the features required in the latest technology tablet. Sufficient speed, memory and picture quality.; Overall tablet is nice ...but if you are using it more than 3.5 hours...then pls dont but it.; i had bought in february and now in june no issues. Tab works smoothly ,only battery drains out quickly even if not using it so have to charge frequently."
"Samsung Galaxy Tab A9+ 27.94 cm (11.0 inch) Display, RAM 8 GB, ROM 128 GB Expandable, Wi-Fi Tablet, Silver","19,999",https://www.amazon.in/sspa/click?ie=UTF8&spc=MTo1MTI5Mzg4NTA5MzYxNzQ6MTcxOTE3MjY0MjpzcF9zZWFyY2hfdGhlbWF0aWM6MzAwMTIwMTk0ODM4MzMyOjo0Ojo&url=%2FSamsung-Galaxy-Tab-A9-Expandable%2Fdp%2FB0CJ393D6H%2Fref%3Dsxin_15_pa_sp_search_thematic_sspa%3Fcontent-id%3Damzn1.sym.ee635213-fee1-408a-be4a-3523feeb9a42%253Aamzn1.sym.ee635213-fee1-408a-be4a-3523feeb9a42%26crid%3D3EKUOWI4I0TPH%26cv_ct_cx%3Dandroid%2Btablet%26dib%3DeyJ2IjoiMSJ9.9aE_WbRtjYZT2BkotcmvxqZertFF_xqxdXh7DKtk804Z19b5ZGJWseXqcFV5yKPc2KkaTCwz4jrq8fL0PRBZAA.G7dTy3e9pM1m6Cn-4MPZXG_MrKvcnA2W7qVCm8hLLLU%26dib_tag%3Dse%26keywords%3Dandroid%2Btablet%26pd_rd_i%3DB0CJ393D6H%26pd_rd_r%3De37d63d7-c9fb-4db3-ac30-ea9a85086bc9%26pd_rd_w%3DLxzve%26pd_rd_wg%3DsMp90%26pf_rd_p%3Dee635213-fee1-408a-be4a-3523feeb9a42%26pf_rd_r%3DGTHMENY49KZ61J8WX2ST%26qid%3D1719172642%26sbo%3DRZvfv%252F%252FHxDF%252BO5021pAnSA%253D%253D%26sprefix%3Dandroid%2Btablet%252Caps%252C251%26sr%3D1-5-ced4eeeb-b190-41d6-902a-1ecb3fb8b7c4-spons%26sp_csd%3Dd2lkZ2V0TmFtZT1zcF9zZWFyY2hfdGhlbWF0aWM%26psc%3D1,https://m.media-amazon.com/images/I/6100f2qmEnL._SY450_.jpg,"Outstanding vividness with 27.94 cm (11.0 ) LCD display, 90 Hz Refresh Rate, 1920 x 1200 (WQXGA); Qualcomm Snapdragon SM6375 Processor; 8 MP AF Rear Camera, 5 MP FF Front camera,Quad Speakers Surround Sound; 7040 mAh Battery; Ram Memory Installed Size: 8.0GB; Memory Storage Capacity: 128.0GB; Battery Capacity: 7040.0 mAH; Special Features: Fast Charging","Samsung galaxy tab A9 plus is very good product, also value for money.; The product meets expectations. Display is good with no extreme stress on eyes. Touch screen is soft to touch. Processor is good and works effectively with speed. I am satisfied with the product.; ; 5g Tab in most affordable price..After buying update the OS,then only touch pen will work properly.; Thy provided me an used product with touch response defect ...and next day refused to exchange rather suggested to go to service center ..... now i am thinking about consumer court; The battery life is extremely poor, draining quickly. I barely had enough time to watch a few YouTube videos and half of a movie on Netflix. Without even using it much the next day, the battery is completely drained, and by evening it's only at 20 percent. The thumb unlocking doesn't work well, and the facial recognition is terrible. Most of the time, you have to type in your password. I can't comprehend why people are so enthusiastic about this product.; Good battery backup good
Display; All of it is perfect...not for heavy gaming; This tablet is only for Arabic regions! My Country/region Is not in it. I will return this tablet and get one that has country choices..... I AM CHANGING MY REVIEW! I FIGURED IT OUT!
I was about to return it when I decided to give it another try! Luckily,
I was able to set it up easily! This tablet is wonderful! Clear picture, very thin and light weight. I am very happy with this tablet and I recommend it. 5 ✨️✨️✨️✨️✨️; Cette tablette ne fonctionne pas au Canada. J’ai parlé à un technicien de Samsung qui m’a dit de contacter Amazon. Incapable de parler à quelqu’un chez Amazon!; Very Happy With It; If you're looking to play casually. Sure. But if you're looking to play professionally or top-tier. Nope. It runs the game just fine, but the screen jitters when you move your camera. It makes precise aiming incredibly impossible sometimes the swiping is fast and sometimes it's slow, it has to do with how the screen registers where your finger is.

And if you play with a six-finger cloth or so many fingers on the screen that this doesn't even know how to sense your fingers.

If you're only looking for performance then this is good, but if you're looking to improve and accurately shoot at people, I can't recommend this.

My previous device was the Apple iPad Pro 2020 11-in and I played professionally on that.

The screen jitteriness on this one makes it almost impossible to be consistently accurate when shooting at people.; Purchased for my wife and she loves everything about it. Nice clear display, great sound quality, and quite a snappy performer. We have had several android tablets but always go back to Samsung. Connects easily to the internet and mobile hotspot from her phone so she can watch her tv shows anywhere. She is very happy and so am I, very happy with this purchase and would recommend to anyone."
"Redmi Pad SE| All day battery | Qualcomm Snapdragon 680| 90Hz Refresh Rate| 4GB, 128GB Tablet| FHD+ Display (11-inch/27.81cm)| Dolby Atmos| Quad Speakers| Wi-Fi| Gray","12,999",https://www.amazon.in/Redmi-battery-Qualcomm-Snapdragon-Speakers/dp/B0D1CG87K5/ref=sr_1_6?crid=3EKUOWI4I0TPH&dib=eyJ2IjoiMSJ9.o-__6ZPnzwQBCpeW31p0A88dFFwjOTuEWsjkvT8sExsb9SE10-HCqRW_5ZP97t9pd-DQuqufTp86X7HPM7EesiD7F-yJ8BmlSgs6qHjx_CVIe1MPWTMu8tOzNuQ9gWuNtYNdM80nLqvsgEyD2z1Sb2ydbFVy5ucKe9n10eKNo49A4bm-VlTztKze8e8pjXHD-wVRZi1yijEPEkgRSaC49IUj48IpOAKaU6UdQ8m4ShQ.dZj-QkTlFM-wBbsmfydfaeeaXNOvIZOLzC1scVItAI4&dib_tag=se&keywords=android+tablet&qid=1719172642&sprefix=android+tablet%2Caps%2C251&sr=8-6,https://m.media-amazon.com/images/I/710WMfH99HL._SY450_.jpg,Snapdragon 680 Octa-Core Processor | Adreno 610 | LPDDR4X RAM | Up to 8GB RAM; 90Hz AdaptiveSync Refresh Rate | 27.9cm(11) Display | FHD+ Resolution | Eye care by TÜV Rheinland | 1920*1200 High Resolution; Quad Speakers with Dolby Atmos | Long Lasting 8000mAh Battery | Android 14 | Multitasking with Split Screen and Floating Windows; 5MP Front Camera with Focus Frame | 8MP Rear Camera | Metal Unibody Design,"I've been using the Redmi Pad SE for a few days now, and I'm really impressed. It feels much more expensive than it is - slim design and stylish looks. But the best part is how well it runs. Apps open fast and everything feels smooth, even when I jump between a bunch of things at once. The battery life is also fantastic - I've been using it for hours on a single charge. Overall, I'm super happy with my purchase. If you're looking for a new tablet, I'd definitely recommend checking this one out.; The Redmi Pad SE is awesome for kicking back and enjoying entertainment. The 11-inch display is super smooth thanks to the 90Hz refresh rate, making everything from movies to games a joy to experience. Plus, the battery lasts for ages, so you can binge-watch worry-free.

The build quality is surprisingly good too - feels really sturdy and secure in your hands. Overall, if you're looking for a big-screen tablet for everyday fun at a great price, the Redmi Pad SE is a great choice!; Nice UX, good screen, good battery, 90hz display is amazing, speakers are above average. Aesthetic form factor. Snapdragon processor. 128gb storage that’s also expandable.
All this for 12k? Il take that.; Firstly, wrong TAB delivered to us (instead of 8 GB - 128 GB, they delivered 6 GB - 128 GB) and moreover, no support from Amazon have to file a consumer case for this.

TAB is real disappointment

It hangs a lot and screen brightness is real issue.

Don't even think of buying this unless you just want to waste your money.; I am writting this review almost after a month of usage of this tablet. I am personally very happy with the product and overall features. Worth to buy with this price for such great performance tablet.; This is a very nice tablet.. Working very smoothly.. Hardware and software both are working fine.. No heating problem.. No hanging.. Viewing experience is very good.. Battery backup is good.. Finish and looks are premium..; Don't expect more with it .. Average product. It is good for browsing and multimedia. Display is good, battery backup could better. Sometimes it will get hang if you use multiple applications.overall it is a average tab. But does its job well.; My best decision to go for the purchase. Display and sound are the highlights for the product with user friendly and smooth UI experience. Overall, great buy at this price point. Definitely recommend to go for this."
"Lenovo Tab M8 (2nd Gen) - 2021 - Tablet - Long Battery Life - 8"" HD - Front 2 MP & Rear 5MP Camera - 2GB Memory - 16GB Storage - Android 9 (Pie),Gray","5,450",https://www.amazon.in/Lenovo-Tab-M8-2nd-Gen/dp/B09GS8H6Q1/ref=sr_1_7?crid=3EKUOWI4I0TPH&dib=eyJ2IjoiMSJ9.o-__6ZPnzwQBCpeW31p0A88dFFwjOTuEWsjkvT8sExsb9SE10-HCqRW_5ZP97t9pd-DQuqufTp86X7HPM7EesiD7F-yJ8BmlSgs6qHjx_CVIe1MPWTMu8tOzNuQ9gWuNtYNdM80nLqvsgEyD2z1Sb2ydbFVy5ucKe9n10eKNo49A4bm-VlTztKze8e8pjXHD-wVRZi1yijEPEkgRSaC49IUj48IpOAKaU6UdQ8m4ShQ.dZj-QkTlFM-wBbsmfydfaeeaXNOvIZOLzC1scVItAI4&dib_tag=se&keywords=android+tablet&qid=1719172642&sprefix=android+tablet%2Caps%2C251&sr=8-7,https://m.media-amazon.com/images/I/61o0EbhjKDL._SX450_.jpg,"The Lenovo Tab M8 has a crisp 8"" HD (1280x800) IPS screen; This Android 10 OS tablet includes 2GB LPDDR3 memory and 16GB storage; Long battery life - Enjoy up to 2 weeks of standby time, up to 18 hours of web browsing, and up to 12 hours of video playback; Video chat or take photos with the 2MP fixed focus front camera and auto focus rear camera; WiFi 2.4/5 GHz, Bluetooth 5.0, Micro USB 2.0 for charging with datasync support, 3.5mm headphone & microphone combo jack, Micro SD card slot","We bought this for teleprompter but it hangs during script reading and waste of time. We have to read same script again and again as screen is stopped during video recording. So for gaming purpose it is 100% NO. It is really waste of money.

Trying to return and buy a better Tablet. Will prefer Samsung than Lenovo.; Very pleased with this m8 16gb tablet, very responsive and well made strong case .
Actually bought this tablet to replace another older tablet that operates a key machine through Bluetooth.
Downloaded the software and bingo , working like a champ .; Funciona bien y con la funda antílopes ya ha resistido varios impacto fuertes y sigue como si nada.; Works perfectly well as my son uses to play games; Use it for a kid. So far so good.; Muy buena tablet,con la calidad de Lenovo,la compré para un niño de 9 años y ha estado super .
Muy recomendable."
