Title,Price,Link,Image URL,Description,Reviews
"Kodak M35 35mm Film Camera (Yellow) - Focus Free, Reusable, Built in Flash, Easy to Use","4,529",https://www.amazon.in/Kodak-35mm-Film-Camera-Yellow/dp/B09BNK9YM3/ref=sr_1_17?crid=4JBM3GA1T7F5&dib=eyJ2IjoiMSJ9.X0BDLWsnuDGIJWy5e5VTQZSQ-Zo6YHRSQjpLBytpQogRqjKvaWaw6yy8Ptzmxvrh3U-VGJnXhczGx1Uz2efO8u5_KjyevthnrJj4pc4dYnZK0SEegi7hbde71RDIqPZXBHG9U7Q_iwxA1mOLj_JF_VMD_-FKCO9tbxMpXLOokwJIa3e1HV-EMVH0HszXhUP8o9OfVP0EgKKGwJQ4J75KJ1adQORgioPYefS4KkYpiEk.3tgCh6JQMEGzVW65k93AMNw6TLfd4QVOanNzn39j1M0&dib_tag=se&keywords=old+analog+film+cameras&qid=1719214751&sprefix=old+analog+filmcameras%2Caps%2C213&sr=8-17,https://m.media-amazon.com/images/I/61M7hjWPzvL._SX679_.jpg,Built In Flash,"They give you just a toy camera in the pack with no essentials ....and the camera is plastic with quality worse than a toy camera ...this is the most disappointing purchase of my life ...don't buy it at all; Bom produto, ela e bem leve , um pouco frágil , porém sou bem cuidadosa então não é um problema. Comprei o filme e já tirei 3 fotos , fiquei muito feliz. Super recomendo se você gosta de fotografia
Cor amarelo; Es bonita la color menta, fácil de usar y tamaño Perfecto para llevarlo a todas partes; Es una buena alternativa para no usar cámaras desechables, la calidad no es muy buena ya que es de plástico pero está muy bien para empezar con el film.; This is the first film camera I bought for myself because I didn't really want to buy a disposable, so as to be a bit more eco-conscious. As many have noted, this is very similar to a toy camera, but it actually takes some quite stunning photos! Everything is fixed, except for the option to turn on/off flash, so it truly is a point-and-shoot. Despite the simplicity, the photos turned out wonderfully! I used the Kodak Gold 200 Colour Film for my first-ever roll, and the pictures were great! This camera is really nice if you want to take your 'disposables' up a notch and not worry about having to throw away everything after a single-use. It's easy to pack into most bags and fanny packs for travel, and it's quite light to carry as well.

One thing I wanted to note: make sure to turn off the flash when you're not using the camera! I always, ALWAYS forget to turn it off, and it drains my battery like crazy. Keep your flash turned off unless you're using it.; me costó meter el carrete porque era la primera vez que tengo una cámara de estas pero funciona perfectamente, la recomiendo"
RETO Reto3D 35mm 3D Film Camera - Retro Lenticular 3D Effect Boomerang Wigglegram Camera,"11,428",https://www.amazon.in/RETO-Reto3D-35mm-Film-Camera/dp/B0949GBLP4/ref=sr_1_18?crid=4JBM3GA1T7F5&dib=eyJ2IjoiMSJ9.X0BDLWsnuDGIJWy5e5VTQZSQ-Zo6YHRSQjpLBytpQogRqjKvaWaw6yy8Ptzmxvrh3U-VGJnXhczGx1Uz2efO8u5_KjyevthnrJj4pc4dYnZK0SEegi7hbde71RDIqPZXBHG9U7Q_iwxA1mOLj_JF_VMD_-FKCO9tbxMpXLOokwJIa3e1HV-EMVH0HszXhUP8o9OfVP0EgKKGwJQ4J75KJ1adQORgioPYefS4KkYpiEk.3tgCh6JQMEGzVW65k93AMNw6TLfd4QVOanNzn39j1M0&dib_tag=se&keywords=old+analog+film+cameras&qid=1719214751&sprefix=old+analog+filmcameras%2Caps%2C213&sr=8-18,https://m.media-amazon.com/images/I/61b146iUOZL._SY450_.jpg,"Flash,Lightweight","I got this for my boyfriend as a gift and he can’t stop talking about it. I am so happy that he liked it!; The camera worked great but after the first roll the teeth are no longer catching the film. I wasted two rolls trying to get it to work and no luck. Would never recommend this to anyone. It’s an expensive paperweight.; Normalerweise schriebe ich keine Produktbewertungen, aber in dem Fall sehe ich mich verpflichtet anderen vom Kauf abzuraten, außer euch ist die Verarbeitung und damit auch Langlebigkeit von dieser Kamera egal.

Erstmal was positives:
Ich weiß von guten Freunden, die diese Kamera auch schon seit Jahren benutzen, dass die Bilder einen coolen Wow Effekt haben können.
Wenn man weiß, was man machen muss, bekommt man coole Bilder raus, das ist sicher.
Soviel dazu.

Jetzt zur Verarbeitung:
Die Kamera ist ein kleines bisschen schwerer als erwartet, aber wirklich nur ganz wenig, ansonsten hält man halt nur Plastik in den Händen, leider ein sehr billiger Ersteindruck und leider wird es noch schlimmer...

Als ich die Kamera das erste Mal aus der Box genommen hab, ist mir sofort aufgefallen, dass sich die ""Lederverzierung"" vorne schon ein gutes Stück abgelöst hat, wie ein zu langer Fingernagel.
Darunter war der ausgetrocknete, alte Kleber zu sehen.

Und leider ist das nicht die Einzige RETO 3D bei der ich dieses Problem schon bemerkt hab.
Bei der Kamera meiner Freunde sieht das ganze noch viel schlimmer aus.
Staub, Dreck und Sand gelangen unter den Kleber und das nachgeahmte Plastik wölbt sich unschön hinauf.

Da meine Freunde ihre Kamera schon etwa 3 Jahre haben, dachte ich es würde daran liegen, dass sie sie viel benutzt haben, aber jetzt scheint es mir so, als wäre das Ganze einfach ein grober Designfehler.

Meine RETO Kamera schicke ich zurück, das ist mir die 60€ definitiv nicht wert.
Ich habe kein Vertrauen, dass die Kamera die nächsten Jahre überleben wird, kein bisschen.
Außerdem gibt es noch mehr analoge Kameras, die einen ähnlichen oder sogar besseren 3D Effekt erzielen können.
Zum Beispiel die Nishika N8000 3D oder Rittai Analog 3D.
Beide kosten gebraucht um die 100€-130€, sind aber qualitativ sicher besser aufgestellt als diese Kamera.
Auch wenn in diesem Fall die Messlatte sehr niedrig liegt.

Ich bin ein großer Fan von gut designten, langlebigen und schönen Produkte und finde es nicht zu viel verlangt, dass eine Kamera, die als neu angeboten wird, auch kurz nach dem auspacken, neu aussieht.

Wenn ihr das auch grundsätzlich so unterstreichen würdet, kauft lieber wo anders eine andere 3D Effekt Kamera.
Ihr werdet dann wahrscheinlich glücklicher, als mit der RETO 3D.; As a professional photographer, I have tested and reviewed the RETO3D 35mm Film Camera extensively. Here are my two positive points and two negative points about this product:

Positive Points:
1. Lenticular 3D effect - The RETO3D camera produces amazing 3D boomerang images that are unique and eye-catching. The lenticular effect adds depth to the images, making them stand out from traditional 2D images. It's a great feature for creative photography and capturing memorable moments in a unique way.
2. Built-in Flash - The RETO3D camera has a built-in flash that works well in low light situations. This is a great feature for indoor and nighttime photography. The flash produces well-lit images with good exposure and contrast.

Negative Points:
1. Limited controls - The RETO3D camera has limited controls with only fixed aperture and shutter speed settings. This can be frustrating for professional photographers who want more control over their images. However, it's a good option for beginners or those who want a simple and easy-to-use camera.
2. Film loading and rewinding - The RETO3D camera requires manual film loading and rewinding, which can be time-consuming and tricky for those who are not familiar with film cameras. It also requires purchasing and developing film, which can be a costly and time-consuming process.

Overall, the RETO3D 35mm Film Camera is a great option for those who want to experiment with 3D boomerang images and are willing to work with film cameras. It has some limitations in terms of controls and film handling, but it's a unique and fun camera to use for creative photography.; It feels nostalgic and it was a great gift to my girlfriend who loves taking pictures!"
Fujifilm Instax Mini Evo Hybrid Camera Premium Edition with 20 Shots of Stone Gray Film and 100 Different Expressions-(Black),"19,999",https://www.amazon.in/Fujifilm-Instax-Premium-Different-Expressions/dp/B0B2CTG2K4/ref=sr_1_19?crid=4JBM3GA1T7F5&dib=eyJ2IjoiMSJ9.X0BDLWsnuDGIJWy5e5VTQZSQ-Zo6YHRSQjpLBytpQogRqjKvaWaw6yy8Ptzmxvrh3U-VGJnXhczGx1Uz2efO8u5_KjyevthnrJj4pc4dYnZK0SEegi7hbde71RDIqPZXBHG9U7Q_iwxA1mOLj_JF_VMD_-FKCO9tbxMpXLOokwJIa3e1HV-EMVH0HszXhUP8o9OfVP0EgKKGwJQ4J75KJ1adQORgioPYefS4KkYpiEk.3tgCh6JQMEGzVW65k93AMNw6TLfd4QVOanNzn39j1M0&dib_tag=se&keywords=old+analog+film+cameras&qid=1719214751&sprefix=old+analog+filmcameras%2Caps%2C213&sr=8-19,https://m.media-amazon.com/images/I/61tSR9mjE+L._SY355_.jpg,"Hybrid instant film camera; 10 Lens x 10 Film Effect Options = 100 Ways of Expression; Built-in selfie mirror so you’re perfectly framed for a selfie, Dual shutter buttons – portrait and landscape; Save printed images onto your Smartphone - Requires download of free INSTAX MINI EVO App - Control the INSTAX MINI EVO camera with your Smartphone for remote shooting - Print photos from your Smartphone via Bluetooth; Save images to a microSD card (microSD card not included)","Just love it.
Don’t think twice and buy it. It’s really worth it. I can just print whichever pic that I took long back. It looks classy and very handy. Love it; It’s a great in-between a digital camera and a old time polaroid. It actually reminiscence early 2000s more then the 80’s though.. but it’s also great for saving some money on film, which is pretty expensive. The Wi-Fi feature is also great. Now you can also have physical copies of your old pictures.; Very cool and fun thing. Mostly we use it like a printer for printing pictures from phone. Very cute device!; ; The camera is easy to use the print out are not rich and would look washed out.
Though instant photo has its charm, I would recommend to go for less expensive options from.
Very expensive per photo cost but that would be same across the board.; when i receive product and i try to start camera there is no battery,then i charged and again try to start but there is no start up screen, in bluetooth setting already one device already paired ....i ordered brand new camera but i received used product; After replacing the item as it wasn't working (not able to print the pictures). After I replaced the item, again same thing is happening. Ot clocks the pictures but unable to print and also eating my films. Preety disappointed by the quality of the camera.; Bought this from nearby camera store, bad color reproduction, too costly at 19k, just a piece of toy. Dont waste money on this"
"Fujifilm Instax Mini 12 Instant Camera + 10 Shot Films + PU Leather Camera Case + Instax Photo Album 64 Sheets + Closeup Selfie Lens (Mint Green, Mini 12)","9,499",https://www.amazon.in/sspa/click?ie=UTF8&spc=MTo1ODI2NjQzMzEwNDQ4MTc1OjE3MTkyMTQ3NTE6c3BfYnRmOjMwMDEwOTM1MDQ2OTczMjo6MDo6&url=%2FFujifilm-Instax-Instant-Leather-Closeup%2Fdp%2FB0CQKCT2M4%2Fref%3Dsr_1_22_sspa%3Fcrid%3D4JBM3GA1T7F5%26dib%3DeyJ2IjoiMSJ9.X0BDLWsnuDGIJWy5e5VTQZSQ-Zo6YHRSQjpLBytpQogRqjKvaWaw6yy8Ptzmxvrh3U-VGJnXhczGx1Uz2efO8u5_KjyevthnrJj4pc4dYnZK0SEegi7hbde71RDIqPZXBHG9U7Q_iwxA1mOLj_JF_VMD_-FKCO9tbxMpXLOokwJIa3e1HV-EMVH0HszXhUP8o9OfVP0EgKKGwJQ4J75KJ1adQORgioPYefS4KkYpiEk.3tgCh6JQMEGzVW65k93AMNw6TLfd4QVOanNzn39j1M0%26dib_tag%3Dse%26keywords%3Dold%2Banalog%2Bfilm%2Bcameras%26qid%3D1719214751%26sprefix%3Dold%2Banalog%2Bfilmcameras%252Caps%252C213%26sr%3D8-22-spons%26sp_csd%3Dd2lkZ2V0TmFtZT1zcF9idGY%26psc%3D1,https://m.media-amazon.com/images/I/61Qn-pChiJL._SY355_.jpg,"Camara is the product of fujifilm instax and accessories are made for instax.; Twist the lens to turn on, twist again for Close-up mode, simple! This mode is ideal for distances of 30 to 50 cm.; When you set the Close-up mode ON, the object in print will be right in the center; Use the selfie mirror to line up your shot. Flash adjusts automatically, even in Close-up mode! Get just the right amount of light without overexposing the photo.; Shutter speed, flash brightness and other settings automatically adjust to ambient light, so you can take the photos with ease.","Not value for money quality of the product is as per the mark, poor quality.not expected such a bad quality"
"KODAK Mini Shot 2 Retro 4PASS 2-in-1 Instant Camera and Photo Printer (2.1x3.4 inches) + 68 Sheets Bundle, Yellow","11,589",https://www.amazon.in/sspa/click?ie=UTF8&spc=MToyNTgyMjM4OTM0NDIxNzU6MTcxOTIxNDkzNDpzcF9hdGZfbmV4dDozMDAyMTYyMDIyNzkwMzI6OjA6Og&url=%2FKODAK-Instant-Camera-Printer-2-1x3-4%2Fdp%2FB088PR8YHX%2Fref%3Dsr_1_17_sspa%3Fcrid%3D4JBM3GA1T7F5%26dib%3DeyJ2IjoiMSJ9.lvO0GCW8VPvBr4-9k_39dgU_vKA9rypuyOeeAQgn2qLf_mTovmo9EZ7PhgrmqlRZXO_lqawJzcVvHmjlTJN2O8bjaQmg7T6Gl5HJ2sfskj85Y69jA_Je6Bi5qUB-NpQeqMcd-gOTiYBS7dF8gApfp4RoAgrvUvYrowON2DiqgBRzWIl-k8aVdc3DxJrmGdaam98H2fXyqb9AZRYDxMYqkPUxSDabY0eQ-CATBjGkDkM.l-mEcFu2lVezNNLlaGpja-I4zswLHENlqBCZRAg-Ce0%26dib_tag%3Dse%26keywords%3Dold%2Banalog%2Bfilm%2Bcameras%26qid%3D1719214934%26sprefix%3Dold%2Banalog%2Bfilmcameras%252Caps%252C213%26sr%3D8-17-spons%26sp_csd%3Dd2lkZ2V0TmFtZT1zcF9hdGZfbmV4dA%26psc%3D1,https://m.media-amazon.com/images/I/71NoX8i+DHL._SY450_.jpg,"Instant Camera + Photo Printer: The Kodak Mini Shot 2 Retro is a polaroid camera with a built-in photo printer, so you can print your images or cancel them after you have taken them. With this instant cameras, you can also print photos directly from the gallery of your mobile device via Bluetooth. This instant photo camera is compatible with Apple iPhone, iPad & Android devices.; Low Photo Cost: Why pay more to print? Printing has never been easier with our Kodak Mini Shot 2 Retro polaroid camera. Photos are even half the cost if purchased in an instant photo camera bundle! The more you print the more you save with this instant cameras and printer.; Superior Photo Quality: The Kodak Mini Shot 2 Retro polaroid camera utilizes 4PASS technology, which allows you to print flawless photos in just a few seconds. As the photos are printed on layers of color and laminated, they are protected against fingerprints and water. Photos last over a 100 years!; Two Photo Types: It is possible to print both bordered and borderless pictures with the Kodak Mini Shot 3 Retro polaroid camera. With this instant camera, you can create lasting memories by writing down your memories in the border type. You can print the borderless type of photo if you want to have them in a larger size.; Augmented Reality App: Download the KODAK Photo Printer application and print from anywhere at any time. With fun augmented reality features and other decorative features such as beauty, filters, frames, and more, you can use the app to express your photos. Our app and instant photo camera will do the rest of the work for you!; To learn how to remove/insert cartridges the right way check the following link: https://support.kodakphotoprinter.com/hc/en-us","Hi. I liked the product but the cartridge inside the camera was stuck when i took out the first print and hence entire cartridge got ruined. Can u send me a replacement cartridge only?; ; Every thing perfect about this product; DO NOT BUY THIS PRODUCT VERY VERY BAD QUALITY WASTE OF MONEY

++ I have been using instant cameras for a while hence choose Kodak in India as the photo sheets were easily available but that was a mistake

++ pathetic picture quality - I choose two of these kodak cameras as gifts to my nieces and now m so embarrassed as when they clicked pictures ( in day light and night ) I saw the horrible quality product which i got them as gift.

++The product is well build but do not go by pictures on the site its misleading \\

++ I cannot get my money refunded as they do not have return policy - of course why ...since they are selling a bad product; Away from this digital world where we can easily delete the pictures I always wanted a mini Polaroid camera to click and create amazing moments and memories and print instantly... And this camera is something which i loved and wanted from a long time... The compact looks and a good quality instant print adds a lot of value for the money that we spend... Thanks Kodak for making such a wonderful product... Loved using it!; ; Don't get me wrong, this is an amazing device but if you have a phone with a decent camera you should buy the Kodak 4 pass mini printer instead as you'll never end up using the camera aspect of this camera.; As the product is superb in quality of printing pictures, but the camera pixels is very low and the most disappointing thing is its battery backup. I can't print more than 5 photos in one full charge and even the camera is draining the battery when it is not in use; Very important to mention what I've called a quasi instant functionality. Unlike real instant cameras where you can make unintentional clicks and accidental photos (and even when it is intentional - it is not always what you've expected), here you are prevented from that. You are taking the picture, see the intermediate result on a tiny screen and only then you can print it if you want. If not - you can retake it, no film wasted. This is a perfect process for me.

Printing speed is very good (I read some complaints about that and don't get it), quality of the photo is very decent. Of cause, it is not a perfect full scale printing. But what could you expect from such a tiny box? It also adds that old-stile, less-technology, analogue vibe. The lack of internal storage - I think it is a plus. Otherwise, it is just a digital camera, but you already have a way more sophisticated one in your phone. And you can connect it and print from the phone.

We did just one cartridge, but I'me sure we will be shooting a lot on this camera.; This printer is not fast, as it does the four pass print. But the photos come out so good. I also have another brand mini photo printer and the quality of the Kodak is so much better. The only problem I have is the battery drains so fast, like after just a few printings. And the on switch takes several attempts to finally turn on, you have to hold your tongue a certain way I think 🤔. I've had an older models of this printer and never had either of these problems with them. Still, I prefer the prints from this printer over the other brand I have by far. And the app you download to use it is super user friendly and allows for editing, frames, collages and more.; Es una cámara muy buena, la calidad de las fotos dependen mas de la calidad del archivo que de la cámara, su lente es baste bajo o de gama baja te va a ser más útil de impresiona que de cámara en si. Pero si sabes de fotografía te resuelves el problema fácil, en resumen vale mucho la pena en verdad. Es increíble; Taşınabilir baskı makinesi olarak kullanıyorum baskı kalitesi çok iyi telefondan çekip bundan baskı alıyorum kendi kamerası da iyi fakat bazı durumlarda yetersiz kalıyor genel olarak 5/5; Lo bueno es poder imprimiras fotos desde la galería del teléfono móvil a travéz del bluetoot lo malo la calidad de las fotos no es tan buena"
"Fujifilm Instax Mini Liplay Hybrid Instant Camera Elite Box Stone White, Compact","16,499",https://www.amazon.in/sspa/click?ie=UTF8&spc=MToyNTgyMjM4OTM0NDIxNzU6MTcxOTIxNDkzNDpzcF9hdGZfbmV4dDoyMDA5NjYxMDc4OTM5ODo6MDo6&url=%2FFujifilm-Instax-Liplay-Instant-Compact%2Fdp%2FB099MTK2DQ%2Fref%3Dsr_1_18_sspa%3Fcrid%3D4JBM3GA1T7F5%26dib%3DeyJ2IjoiMSJ9.lvO0GCW8VPvBr4-9k_39dgU_vKA9rypuyOeeAQgn2qLf_mTovmo9EZ7PhgrmqlRZXO_lqawJzcVvHmjlTJN2O8bjaQmg7T6Gl5HJ2sfskj85Y69jA_Je6Bi5qUB-NpQeqMcd-gOTiYBS7dF8gApfp4RoAgrvUvYrowON2DiqgBRzWIl-k8aVdc3DxJrmGdaam98H2fXyqb9AZRYDxMYqkPUxSDabY0eQ-CATBjGkDkM.l-mEcFu2lVezNNLlaGpja-I4zswLHENlqBCZRAg-Ce0%26dib_tag%3Dse%26keywords%3Dold%2Banalog%2Bfilm%2Bcameras%26qid%3D1719214934%26sprefix%3Dold%2Banalog%2Bfilmcameras%252Caps%252C213%26sr%3D8-18-spons%26sp_csd%3Dd2lkZ2V0TmFtZT1zcF9hdGZfbmV4dA%26psc%3D1,https://m.media-amazon.com/images/I/613iXgpU0FS._SX425_.jpg,"Instax Elite Box- Mini Liplay your companion for any special occasion. Click the moment, print the same and store it as your beautful memory forever.; Capture and instantly print photos from the camera or directly print from your - smartphone/ tablet using Bluetooth.; Choose from a variety of frames and filters for more printing fun.; Attach a recorded sound to your photo and play back by scanning the QR code, easily capture Group photos by using your smartphone as a shutter button, review and select photos before printing.; Uses instax ""mini"" film.","Nice product; Working very well; *Read till the end.
The camera works perfectly fine. Prints good quality images and will also record a voice QR for your memorable behind the scene giggles and joys. Do not expect the picture quality of the highest standards, this is meant to keep your moments in a print format as it occurs. Not everyone may like it a lot due to the individual pictures price. But to me capturing pictures and the joy of getting an instant image is far greater. Combo package gives you an option of instantly keeping your photos into. The fridge magnets are another good way to show your memories to the visitors. Though placing the magnet is a bit tricky.
I was looking at the Instax mini 11 before looking into pros and cons of both. Then this seemed like a better option for few extra bucks (with all the offers I got it for 10.4k approx).
*Give a thumbs-up if you like the review.; Easy to use, The print quality (from phone) is really good. Camera picture quality gets slightly out of focus/ undefined but decent when close to subject (the sound recording and frame option is only available in camera picture). One advantage of camera picture is that it doesn't print immediately, you can retake pics and choose the best to print - you can avoid under/over exposure this way (the rest can be stored in SD card). The photo book quality that comes along with this pack isn't great, so i bought another one. Over-all happy with my purchase.; Good packaging . Good quality . Go for it; Best in Instax mini Model.; The camera clarity is not at all good, though it can be used as a printer as it provides convenience of printing, one should rather go for only printer version from Fuji instead of camera; No doubt . . Go for it"
"Kodak M38 35mm Film Camera - Focus Free, Powerful Built-in Flash, Easy to Use (Clouds White)","6,226",https://www.amazon.in/Kodak-35mm-Film-Camera-Built/dp/B09DYPTGBX/ref=sr_1_19?crid=4JBM3GA1T7F5&dib=eyJ2IjoiMSJ9.lvO0GCW8VPvBr4-9k_39dgU_vKA9rypuyOeeAQgn2qLf_mTovmo9EZ7PhgrmqlRZXO_lqawJzcVvHmjlTJN2O8bjaQmg7T6Gl5HJ2sfskj85Y69jA_Je6Bi5qUB-NpQeqMcd-gOTiYBS7dF8gApfp4RoAgrvUvYrowON2DiqgBRzWIl-k8aVdc3DxJrmGdaam98H2fXyqb9AZRYDxMYqkPUxSDabY0eQ-CATBjGkDkM.l-mEcFu2lVezNNLlaGpja-I4zswLHENlqBCZRAg-Ce0&dib_tag=se&keywords=old+analog+film+cameras&qid=1719214934&sprefix=old+analog+filmcameras%2Caps%2C213&sr=8-19,https://m.media-amazon.com/images/I/61jS+cL2XaL._SY450_.jpg,"Kodak M38 35mm Film Camera - Focus Free, Powerful Built-in Flash, Easy to Use (Clouds White); 35mm Reusable Film Camera; Accepts 1 x AAA Battery; Fixed-Focus Wide-Angle Lens; Built-In Flash","it's a 100 gm plastic built cheap camera .. with doubtful durability and performance ...
would advice against buying it ..; Product came with a letter explaining the product and information on getting the film printed out, happily answered any questions I had with contact info that came in order!; it worked fine for the first roll of film and then after that the scroll now no longer spins the film inside which means that the film won’t catch and the entire camera doesn’t work. if you’re looking for a cheap point and shoot film camera i suggest doing a little more research and spending a few extra quidd and get yourself something that is known to last and does a good job (look on ebay, Pentax Espio’s tend to be fairly cheap and reliable); I tried multiple and this one seems to work best. Keep in mind that if you take it beach or use it multiple time it will get dirty and won’t work as smoothly. But this was less of a issue and happened after more rolls than other similar cameras I tried.; I don’t ever wrote reviews except for this one.. the camera came opened in its packaging. I should have read the reviews since it seems a lot of people experienced this. Kodak, get it together.; Das Paket in der die Kamera geliefert wurde war zwar unbeschädigt, aber die Verpackung der Kamera wurde bereits einmal geöffnet und wurde danach wieder zugeklebt. In der geöffneten Verpackung waren Staub und Dreck, sodass die Kamera bereits zerkratzt war. Die Kamera wird als Neuware angeboten, ist aber bereits vorher einmal geöffnet und dann verschickt worden. Die Kamera ist von der Qualität her wie eine Plastik Einweg-Kamera vom Drogeriemarkt."
"Kodak M38 35mm Film Camera - Focus Free, Powerful Built-in Flash, Easy to Use (Classic Blue)","5,386",https://www.amazon.in/Kodak-35mm-Film-Camera-Built/dp/B09DYPCV5X/ref=sr_1_20?crid=4JBM3GA1T7F5&dib=eyJ2IjoiMSJ9.lvO0GCW8VPvBr4-9k_39dgU_vKA9rypuyOeeAQgn2qLf_mTovmo9EZ7PhgrmqlRZXO_lqawJzcVvHmjlTJN2O8bjaQmg7T6Gl5HJ2sfskj85Y69jA_Je6Bi5qUB-NpQeqMcd-gOTiYBS7dF8gApfp4RoAgrvUvYrowON2DiqgBRzWIl-k8aVdc3DxJrmGdaam98H2fXyqb9AZRYDxMYqkPUxSDabY0eQ-CATBjGkDkM.l-mEcFu2lVezNNLlaGpja-I4zswLHENlqBCZRAg-Ce0&dib_tag=se&keywords=old+analog+film+cameras&qid=1719214934&sprefix=old+analog+filmcameras%2Caps%2C213&sr=8-20,https://m.media-amazon.com/images/I/61r3PUY8roL._SY450_.jpg,35mm Reusable Film Camera; Accepts 1 x AAA Battery; Fixed-Focus Wide-Angle Lens; Built-In Flash; Optical Viewfinder,"; Produto muito bom, chegou no dia agendado; Le mitiche 35mm… mi ricorda l’infanzia con la mia famiglia, in vacanza all’Italia in Miniatura… le foto sviluppate dai rullini hanno tutto un altro valore. Un po’ di nostalgia anche per il prezzo visto che quelle usa e getta costavano qualcosa come 10’000 Lire, però questa dura un po’ di più quindi il prezzo è giusto. Le consiglio a chi come me ha vissuto i magici anni dal 90 in poi, non ve ne pentirete; Purtroppo dopo pochi giorni di utilizzo il flash si è rotto. 5 stelle ad amazon che mi ha fatto il reso nonostante fosse passato di 1 o 2 giorni il limite per il reso; すでに開封されたと思われる商品が届いた。気持ち悪い。返品しました。評価は星を一つもつけられない。"
