Title,Price,Link,Image URL,Description,Reviews
"KODAK Mini Shot 2 Retro 4PASS 2-in-1 Instant Camera and Photo Printer (2.1x3.4 inches) + 68 Sheets Bundle, White","11,589",https://www.amazon.in/sspa/click?ie=UTF8&spc=MTo2ODU2NjA4Njk4ODQxMTc1OjE3MTkyMTUxMjE6c3BfYXRmX25leHQ6MzAwMjE2MjAyMjc4ODMyOjowOjo&url=%2FKODAK-Instant-Camera-Printer-2-1x3-4%2Fdp%2FB088PQR3YL%2Fref%3Dsr_1_34_sspa%3Fcrid%3D4JBM3GA1T7F5%26dib%3DeyJ2IjoiMSJ9.UmaV5umG57L5_CSPo-ZWcmpc8R8LM3Yix11bwLYADKj80BT6IjBCi_Itjms49FbnkfLhFsh8Parh1Py28WpkIge9VSNVV9vhnVT7KwgZXq0Kl_7iVgGNxkUmCFRWl9x5NcVK0bjMc0Ddnd-y-do5F0QkRLshi6CJKCfpKy7K1607-Rw9e6h3XACwsYvV04Ztg49t7zLpIxsXb39SYBsMtmYEN-W9WV9p-HDOv5IogPI.OqRJ7M4QzBW7nW9agZ2zWuI9p09WutTvSh39j9eyk7M%26dib_tag%3Dse%26keywords%3Dold%2Banalog%2Bfilm%2Bcameras%26qid%3D1719215121%26sprefix%3Dold%2Banalog%2Bfilmcameras%252Caps%252C213%26sr%3D8-34-spons%26sp_csd%3Dd2lkZ2V0TmFtZT1zcF9hdGZfbmV4dA%26psc%3D1,https://m.media-amazon.com/images/I/71PKykoETmL._SY450_.jpg,"Instant Camera + Photo Printer: The Kodak Mini Shot 2 Retro is a polaroid camera with a built-in photo printer, so you can print your images or cancel them after you have taken them. With this instant cameras, you can also print photos directly from the gallery of your mobile device via Bluetooth. This instant photo camera is compatible with Apple iPhone, iPad & Android devices.; Low Photo Cost: Why pay more to print? Printing has never been easier with our Kodak Mini Shot 2 Retro polaroid camera. Photos are even half the cost if purchased in an instant photo camera bundle! The more you print the more you save with this instant cameras and printer.; Superior Photo Quality: The Kodak Mini Shot 2 Retro polaroid camera utilizes 4PASS technology, which allows you to print flawless photos in just a few seconds. As the photos are printed on layers of color and laminated, they are protected against fingerprints and water. Photos last over a 100 years!; Two Photo Types: It is possible to print both bordered and borderless pictures with the Kodak Mini Shot 3 Retro polaroid camera. With this instant camera, you can create lasting memories by writing down your memories in the border type. You can print the borderless type of photo if you want to have them in a larger size.; Augmented Reality App: Download the KODAK Photo Printer application and print from anywhere at any time. With fun augmented reality features and other decorative features such as beauty, filters, frames, and more, you can use the app to express your photos. Our app and instant photo camera will do the rest of the work for you!","Hi. I liked the product but the cartridge inside the camera was stuck when i took out the first print and hence entire cartridge got ruined. Can u send me a replacement cartridge only?; ; Every thing perfect about this product; DO NOT BUY THIS PRODUCT VERY VERY BAD QUALITY WASTE OF MONEY

++ I have been using instant cameras for a while hence choose Kodak in India as the photo sheets were easily available but that was a mistake

++ pathetic picture quality - I choose two of these kodak cameras as gifts to my nieces and now m so embarrassed as when they clicked pictures ( in day light and night ) I saw the horrible quality product which i got them as gift.

++The product is well build but do not go by pictures on the site its misleading \\

++ I cannot get my money refunded as they do not have return policy - of course why ...since they are selling a bad product; Away from this digital world where we can easily delete the pictures I always wanted a mini Polaroid camera to click and create amazing moments and memories and print instantly... And this camera is something which i loved and wanted from a long time... The compact looks and a good quality instant print adds a lot of value for the money that we spend... Thanks Kodak for making such a wonderful product... Loved using it!; ; Don't get me wrong, this is an amazing device but if you have a phone with a decent camera you should buy the Kodak 4 pass mini printer instead as you'll never end up using the camera aspect of this camera.; As the product is superb in quality of printing pictures, but the camera pixels is very low and the most disappointing thing is its battery backup. I can't print more than 5 photos in one full charge and even the camera is draining the battery when it is not in use; Very important to mention what I've called a quasi instant functionality. Unlike real instant cameras where you can make unintentional clicks and accidental photos (and even when it is intentional - it is not always what you've expected), here you are prevented from that. You are taking the picture, see the intermediate result on a tiny screen and only then you can print it if you want. If not - you can retake it, no film wasted. This is a perfect process for me.

Printing speed is very good (I read some complaints about that and don't get it), quality of the photo is very decent. Of cause, it is not a perfect full scale printing. But what could you expect from such a tiny box? It also adds that old-stile, less-technology, analogue vibe. The lack of internal storage - I think it is a plus. Otherwise, it is just a digital camera, but you already have a way more sophisticated one in your phone. And you can connect it and print from the phone.

We did just one cartridge, but I'me sure we will be shooting a lot on this camera.; This printer is not fast, as it does the four pass print. But the photos come out so good. I also have another brand mini photo printer and the quality of the Kodak is so much better. The only problem I have is the battery drains so fast, like after just a few printings. And the on switch takes several attempts to finally turn on, you have to hold your tongue a certain way I think 🤔. I've had an older models of this printer and never had either of these problems with them. Still, I prefer the prints from this printer over the other brand I have by far. And the app you download to use it is super user friendly and allows for editing, frames, collages and more.; Es una cámara muy buena, la calidad de las fotos dependen mas de la calidad del archivo que de la cámara, su lente es baste bajo o de gama baja te va a ser más útil de impresiona que de cámara en si. Pero si sabes de fotografía te resuelves el problema fácil, en resumen vale mucho la pena en verdad. Es increíble; Taşınabilir baskı makinesi olarak kullanıyorum baskı kalitesi çok iyi telefondan çekip bundan baskı alıyorum kendi kamerası da iyi fakat bazı durumlarda yetersiz kalıyor genel olarak 5/5; Lo bueno es poder imprimiras fotos desde la galería del teléfono móvil a travéz del bluetoot lo malo la calidad de las fotos no es tan buena"
"FotoCart Instax Camera Mini Films Colorful Frame Compatible with Fujifilm Mini 8 8+ 9 70 7s 90 25 26 50s Film, 10 Pcs (Square)",342,https://www.amazon.in/FotoCart-Instax-Colorful-Compatible-Fujifilm/dp/B09C11PCSN/ref=sr_1_35?crid=4JBM3GA1T7F5&dib=eyJ2IjoiMSJ9.UmaV5umG57L5_CSPo-ZWcmpc8R8LM3Yix11bwLYADKj80BT6IjBCi_Itjms49FbnkfLhFsh8Parh1Py28WpkIge9VSNVV9vhnVT7KwgZXq0Kl_7iVgGNxkUmCFRWl9x5NcVK0bjMc0Ddnd-y-do5F0QkRLshi6CJKCfpKy7K1607-Rw9e6h3XACwsYvV04Ztg49t7zLpIxsXb39SYBsMtmYEN-W9WV9p-HDOv5IogPI.OqRJ7M4QzBW7nW9agZ2zWuI9p09WutTvSh39j9eyk7M&dib_tag=se&keywords=old+analog+film+cameras&qid=1719215121&sprefix=old+analog+filmcameras%2Caps%2C213&sr=8-35,https://m.media-amazon.com/images/I/619NF0oWZLS._SY450_.jpg,"Unique and lightweight, one rope and 10 clips for easy display, can be hang on a wall to show your best instant photos, also great decoration for your sweet home; Modern and luxurious premium, practical design and exquisite workmanship, combine practicability with popular fashion; Make your picture more funny and memorable; Fashionable and cute appearance designed mini frame, attractive and protective; Compatible with Fujifilm Instax Mini 8 7S 25 50S 90 films",I loved it!
"1 Shot Point and Shoot 35mm Film Camera Reusable Retro Half Frame Camera, Built in Flash, Included One Roll ASA/ISO 400 Black & White Film 18 Exp., (36 Shots) Battery Not Included (Green Color)","7,342",https://www.amazon.in/Shot-Camera-Reusable-Included-Battery/dp/B0B6P1G362/ref=sr_1_36?crid=4JBM3GA1T7F5&dib=eyJ2IjoiMSJ9.UmaV5umG57L5_CSPo-ZWcmpc8R8LM3Yix11bwLYADKj80BT6IjBCi_Itjms49FbnkfLhFsh8Parh1Py28WpkIge9VSNVV9vhnVT7KwgZXq0Kl_7iVgGNxkUmCFRWl9x5NcVK0bjMc0Ddnd-y-do5F0QkRLshi6CJKCfpKy7K1607-Rw9e6h3XACwsYvV04Ztg49t7zLpIxsXb39SYBsMtmYEN-W9WV9p-HDOv5IogPI.OqRJ7M4QzBW7nW9agZ2zWuI9p09WutTvSh39j9eyk7M&dib_tag=se&keywords=old+analog+film+cameras&qid=1719215121&sprefix=old+analog+filmcameras%2Caps%2C213&sr=8-36,https://m.media-amazon.com/images/I/61t7q2tFfWL._SY355_.jpg,"📷 A MUST FOR FILM CAMERA HOBBYISTS: 1 Shot retro half frame reusable point and shoot 35mm film camera, a delightful camera, compact & functional, light in weight, good for portrait photos reloadable film camera.; 📷 FOCUS FREE LIGHT IN WEIGHT EASY TO USE: 1 Shot half frame reusable film cameras are very easy to use, it is suitable for film camera beginners. Light in weight, convenient for travels and special occasions.; 📷 CLASSIC BLACK & WHITE FILM: One roll of black and white film 35mm film with 18 Exposures is bundled. Black and white pictures can bring a new perspective and aesthetic to your photos, the different lighting contrasts that come to life and creating classic timeless grainy nostalgic photos. Our B/W film is made in EU.; 📷 COST SAVING & ENVIRONMENT FRIENDLY: Shoot 18×24mm photographs on 35mm film, that’s half of what standard full-frame cameras takes (24×36mm), portrait photos, smartphone viewing friendly. Cost saving product, environmental friendly for using less film—a 24-, or 36-frame roll yields twice the number of shots on a 35mm film. It is double.; 📷 PERFECT FOR OUTDOORS & INDOORS SHOOTING: One button fully automatic point and shoot camera with 1/120s shutter speed, 50mm lens, fixed focusing, has an aperture of F5.6 perfect for daytime scenes. Built-in flash, recommended using 1 AAA alkaline battery and the flash has 10-15 seconds recycle time, it’s perfect for night time or party shoot. (AAA battery is not included)","Pretty fun camera to play around with!

It comes with one roll of black and white, 400 ISO film that shoots half frame photos. The roll comes with a total of 18 exposures with two photos each (so total of 36 unique photos).

The camera itself is a definite throwback to the 90s, where everyone I knew had one of these or one of those disposable ones.

Usage is fairly straightforward - load the film, wind it, and snap photos.

There is a flash which is activated via the toggle switch located at the front of the camera.

This is a fixed focus camera with an aperture of 5.6. Coupled with the 400 ISO film, this camera should yield good photos in daytime and outdoor conditions, or well lit indoor areas as well.

There's an instruction manual included that provides some basic pointers as well.

Fun novelty item.... now I just need to find a place that still develops film!; Cute little camera but feels just like a little disposable camera. Wish it was a little more durable.
Decent for price though; Very reasonably priced so didn’t expect much it’s for my college age granddaughter. Hope she liked it. She asked for this specific one!; This is a very unique camera--particularly in a world where there area so many excellent digital photo/video options. First off, it looks very retro--and that's appropriate for a camera that uses actual 35 mm film! But wait--there's more: the camera takes half sized photos. That's 18×24mm for those of you scoring at home. The first roll of film (18 exposures) is bundled but the rest is up to you. You'll also need a AAA battery which is not included. To their credit, they make abundantly clear that the battery isn't included.

It's a fun camera to shoot and a vivid reminder of how far we've come in terms of photo equipment. It wasn't *that* long ago where camera equipment was expensive. Even basic Instamatic type cameras weren't cheap. Now everyone has a higher quality camera on their phone--and with some phones the camera is state of the art. Now I just need to figure out where to get it developed, something I haven't thought about in well over a decade. Recommended!; While this product does bring back memories, I did have problems with the door for putting the film in the camera. It is very difficult to open. Other than that, the camera is simple to operate and as expected. It's fun to take film in to get developed again!"
"RETO Ultra Wide and Slim 35mm Reusable Daylight Film Camera - 22mm Wide Lens, Focus Free, Light Weight, Easy to Use (Murky Blue)","5,209",https://www.amazon.in/RETO-Ultra-Wide-Reusable-Camera/dp/B09QSHDVDG/ref=sr_1_37?crid=4JBM3GA1T7F5&dib=eyJ2IjoiMSJ9.UmaV5umG57L5_CSPo-ZWcmpc8R8LM3Yix11bwLYADKj80BT6IjBCi_Itjms49FbnkfLhFsh8Parh1Py28WpkIge9VSNVV9vhnVT7KwgZXq0Kl_7iVgGNxkUmCFRWl9x5NcVK0bjMc0Ddnd-y-do5F0QkRLshi6CJKCfpKy7K1607-Rw9e6h3XACwsYvV04Ztg49t7zLpIxsXb39SYBsMtmYEN-W9WV9p-HDOv5IogPI.OqRJ7M4QzBW7nW9agZ2zWuI9p09WutTvSh39j9eyk7M&dib_tag=se&keywords=old+analog+film+cameras&qid=1719215121&sprefix=old+analog+filmcameras%2Caps%2C213&sr=8-37,https://m.media-amazon.com/images/I/51YL-LuNMfL._SY450_.jpg,"22mm Ultra Wide Lens; Super Light and Slim; Point and shoot; Battery Free; Focus Free, 1m to infinity","The seller was great and shipping fast and on time. Happy customer!

Short review: Excellent, crazy fun camera. Pick one up!

Long, drawn out review: Buy one! The Reto Ultra Wide and Slim is a hoot to carry and shoot with. Super light and unobtrusive to carry anywhere. I did not understand the hype of the previous incarnations of this camera until I ran a few rolls through it. Super fun! You outta purchase one!

I am still waiting on the lab to send my film back, maybe this week. I am quite familiar with the lo-fi/ Lomo aesthetic in film photography (Holga's, Dianas, pinhole, 110 format, etc.), but I expect to be pleasantly surprised by the results of the RUWS. The results of this camera view online are compelling, if my shots are half as good I will be over the moon.

Even though I wish this camera had multiple exposure capability, and a hotshoe, and some exposure control, and on and on; I know in my heart it would ruin the experience. This is about as basic as it gets (a box that holds film) and it is up to me to use my skills and creativity as a photographer to create worthwhile photos. BTW, get one. No home should be without a RUWS!

Even though I have a number of cameras at my disposal, the RUWS most certainly will get the nod often. You should get one! Steal it if you must, lol.

In closing, just do it already. Nothing ventured, nothing gained.; Every roll of film I used in this camera was ruined or blank. The camera simply doesn’t work at all. I spent lots of money mailing film to be developed and both the camera and that process was a waste. Don’t buy this camera. I’ve tried many things to make it work and it just doesn’t.; Works perfectly; È un accessorio, carino, colorato, effetto retro sia nel design che nella resa degli scatti. Non ne caverete però immagini tecnicamente soddisfacenti, escono tutte scure anche scattate in piena luce. Con il costo che hanno oggi le pellicole, è meglio usarle con macchine dignitose e non delle macchinette come queste. Qualità costruttiva un po' scadente, costa poco e vale poco, che dire. Carinissima come soprammobile.; No por nada el modelo original (vivitar) se convirtio de culto. Su tamaño compacto, su gran angular, y facil uso la vuelve ideal para el que arranca con film. Super rapida de usar, te olvidas del enfoque, solo requieres saber exponer. Idealmente usar fotometro, pero si no es el caso podras hacerlo facil con la regla ""sunny 16"" buscalo! A la mia la modifique para poder usar filtros nd de 37mm y asi poder tener una exposicion mucho mas amplia y usable sin que obstruya el visor. No pesa nada!"
"KODAK Mini Shot 2 Retro 4PASS 2-in-1 Instant Camera and Photo Printer (2.1x3.4) + 8 Sheets, White","10,739",https://www.amazon.in/KODAK-Instant-Camera-Printer-2-1x3-4/dp/B084MKGMSQ/ref=sr_1_38?crid=4JBM3GA1T7F5&dib=eyJ2IjoiMSJ9.UmaV5umG57L5_CSPo-ZWcmpc8R8LM3Yix11bwLYADKj80BT6IjBCi_Itjms49FbnkfLhFsh8Parh1Py28WpkIge9VSNVV9vhnVT7KwgZXq0Kl_7iVgGNxkUmCFRWl9x5NcVK0bjMc0Ddnd-y-do5F0QkRLshi6CJKCfpKy7K1607-Rw9e6h3XACwsYvV04Ztg49t7zLpIxsXb39SYBsMtmYEN-W9WV9p-HDOv5IogPI.OqRJ7M4QzBW7nW9agZ2zWuI9p09WutTvSh39j9eyk7M&dib_tag=se&keywords=old+analog+film+cameras&qid=1719215121&sprefix=old+analog+filmcameras%2Caps%2C213&sr=8-38,https://m.media-amazon.com/images/I/71Y0JbOZL8L._SY450_.jpg,"CAMERA & PRINTER: Our Kodak Mini Shot 2 Retro allows you to shoot and print snapshots anytime and anywhere! Print them directly from the Kodak Mini Shot 2 Retro or connect it to any mobile device via Bluetooth to print from the photo gallery quickly and effortlessly.; EXCLUSIVE DESIGN: What does it take to shoot and print amazing pics? Your mobile devices and the Kodak 4Pass! Use this amazing gadget indoors, outdoors, in professional studios or at home! It has a unique retro design that you will fall in love with instantly. The Mini Shot 2 Retro camera feels exclusive and luxurious, so you can feel like a real photographer from the 60s.; PREMIUM QUALITY: Kodak Mini Shot uses 4Pass Technology to print flawless photos instantly. Each photo is printed in layers of ribbon with a laminating process so itâ€s fingerprint proof and water-resistant for long-lasting quality.; ENJOY THE KODAK APP: We have developed a free Kodak app that allows you to print anywhere and anytime. You can enjoy decorating real photos with stickers, frames and filters with a simple and intuitive app that is compatible with iOS and Android devices.; THE RIGHT CHOICE FOR YOUR LOVES ONES: Share outstanding memories with your family and friends by using these high-quality photos! Print your favorite pics and keep those images intact forever.","Hi. I liked the product but the cartridge inside the camera was stuck when i took out the first print and hence entire cartridge got ruined. Can u send me a replacement cartridge only?; ; Every thing perfect about this product; DO NOT BUY THIS PRODUCT VERY VERY BAD QUALITY WASTE OF MONEY

++ I have been using instant cameras for a while hence choose Kodak in India as the photo sheets were easily available but that was a mistake

++ pathetic picture quality - I choose two of these kodak cameras as gifts to my nieces and now m so embarrassed as when they clicked pictures ( in day light and night ) I saw the horrible quality product which i got them as gift.

++The product is well build but do not go by pictures on the site its misleading \\

++ I cannot get my money refunded as they do not have return policy - of course why ...since they are selling a bad product; Away from this digital world where we can easily delete the pictures I always wanted a mini Polaroid camera to click and create amazing moments and memories and print instantly... And this camera is something which i loved and wanted from a long time... The compact looks and a good quality instant print adds a lot of value for the money that we spend... Thanks Kodak for making such a wonderful product... Loved using it!; ; Don't get me wrong, this is an amazing device but if you have a phone with a decent camera you should buy the Kodak 4 pass mini printer instead as you'll never end up using the camera aspect of this camera.; As the product is superb in quality of printing pictures, but the camera pixels is very low and the most disappointing thing is its battery backup. I can't print more than 5 photos in one full charge and even the camera is draining the battery when it is not in use; Very important to mention what I've called a quasi instant functionality. Unlike real instant cameras where you can make unintentional clicks and accidental photos (and even when it is intentional - it is not always what you've expected), here you are prevented from that. You are taking the picture, see the intermediate result on a tiny screen and only then you can print it if you want. If not - you can retake it, no film wasted. This is a perfect process for me.

Printing speed is very good (I read some complaints about that and don't get it), quality of the photo is very decent. Of cause, it is not a perfect full scale printing. But what could you expect from such a tiny box? It also adds that old-stile, less-technology, analogue vibe. The lack of internal storage - I think it is a plus. Otherwise, it is just a digital camera, but you already have a way more sophisticated one in your phone. And you can connect it and print from the phone.

We did just one cartridge, but I'me sure we will be shooting a lot on this camera.; This printer is not fast, as it does the four pass print. But the photos come out so good. I also have another brand mini photo printer and the quality of the Kodak is so much better. The only problem I have is the battery drains so fast, like after just a few printings. And the on switch takes several attempts to finally turn on, you have to hold your tongue a certain way I think 🤔. I've had an older models of this printer and never had either of these problems with them. Still, I prefer the prints from this printer over the other brand I have by far. And the app you download to use it is super user friendly and allows for editing, frames, collages and more.; Es una cámara muy buena, la calidad de las fotos dependen mas de la calidad del archivo que de la cámara, su lente es baste bajo o de gama baja te va a ser más útil de impresiona que de cámara en si. Pero si sabes de fotografía te resuelves el problema fácil, en resumen vale mucho la pena en verdad. Es increíble; Taşınabilir baskı makinesi olarak kullanıyorum baskı kalitesi çok iyi telefondan çekip bundan baskı alıyorum kendi kamerası da iyi fakat bazı durumlarda yetersiz kalıyor genel olarak 5/5; Lo bueno es poder imprimiras fotos desde la galería del teléfono móvil a travéz del bluetoot lo malo la calidad de las fotos no es tan buena"
"RETO Ultra Wide and Slim 35mm Reusable Daylight Film Camera - 22mm Wide Lens, Focus Free, Light Weight, Easy to Use (Muddy Yellow)","5,288",https://www.amazon.in/RETO-Ultra-Wide-Reusable-Camera/dp/B09QSFWR9M/ref=sr_1_39?crid=4JBM3GA1T7F5&dib=eyJ2IjoiMSJ9.UmaV5umG57L5_CSPo-ZWcmpc8R8LM3Yix11bwLYADKj80BT6IjBCi_Itjms49FbnkfLhFsh8Parh1Py28WpkIge9VSNVV9vhnVT7KwgZXq0Kl_7iVgGNxkUmCFRWl9x5NcVK0bjMc0Ddnd-y-do5F0QkRLshi6CJKCfpKy7K1607-Rw9e6h3XACwsYvV04Ztg49t7zLpIxsXb39SYBsMtmYEN-W9WV9p-HDOv5IogPI.OqRJ7M4QzBW7nW9agZ2zWuI9p09WutTvSh39j9eyk7M&dib_tag=se&keywords=old+analog+film+cameras&qid=1719215121&sprefix=old+analog+filmcameras%2Caps%2C213&sr=8-39,https://m.media-amazon.com/images/I/512SSaYu83L._SY450_.jpg,"22mm Ultra Wide Lens; Super Light and Slim; Point and shoot; Battery Free; Focus Free, 1m to infinity","The seller was great and shipping fast and on time. Happy customer!

Short review: Excellent, crazy fun camera. Pick one up!

Long, drawn out review: Buy one! The Reto Ultra Wide and Slim is a hoot to carry and shoot with. Super light and unobtrusive to carry anywhere. I did not understand the hype of the previous incarnations of this camera until I ran a few rolls through it. Super fun! You outta purchase one!

I am still waiting on the lab to send my film back, maybe this week. I am quite familiar with the lo-fi/ Lomo aesthetic in film photography (Holga's, Dianas, pinhole, 110 format, etc.), but I expect to be pleasantly surprised by the results of the RUWS. The results of this camera view online are compelling, if my shots are half as good I will be over the moon.

Even though I wish this camera had multiple exposure capability, and a hotshoe, and some exposure control, and on and on; I know in my heart it would ruin the experience. This is about as basic as it gets (a box that holds film) and it is up to me to use my skills and creativity as a photographer to create worthwhile photos. BTW, get one. No home should be without a RUWS!

Even though I have a number of cameras at my disposal, the RUWS most certainly will get the nod often. You should get one! Steal it if you must, lol.

In closing, just do it already. Nothing ventured, nothing gained.; Every roll of film I used in this camera was ruined or blank. The camera simply doesn’t work at all. I spent lots of money mailing film to be developed and both the camera and that process was a waste. Don’t buy this camera. I’ve tried many things to make it work and it just doesn’t.; Works perfectly; È un accessorio, carino, colorato, effetto retro sia nel design che nella resa degli scatti. Non ne caverete però immagini tecnicamente soddisfacenti, escono tutte scure anche scattate in piena luce. Con il costo che hanno oggi le pellicole, è meglio usarle con macchine dignitose e non delle macchinette come queste. Qualità costruttiva un po' scadente, costa poco e vale poco, che dire. Carinissima come soprammobile.; No por nada el modelo original (vivitar) se convirtio de culto. Su tamaño compacto, su gran angular, y facil uso la vuelve ideal para el que arranca con film. Super rapida de usar, te olvidas del enfoque, solo requieres saber exponer. Idealmente usar fotometro, pero si no es el caso podras hacerlo facil con la regla ""sunny 16"" buscalo! A la mia la modifique para poder usar filtros nd de 37mm y asi poder tener una exposicion mucho mas amplia y usable sin que obstruya el visor. No pesa nada!"
