Title,Price,Link,Image URL,Description,Reviews
Holga Holga 120 WPC Panoramic Pin Hole Camera Wide Format Film Lomo Camera Black,"10,411",https://www.amazon.in/Holga-Panoramic-Camera-Format-Black/dp/B07M937HNV/ref=sr_1_55?crid=4JBM3GA1T7F5&dib=eyJ2IjoiMSJ9.NO5uvOtYuVMy0p5kpi6Wimx5DLt-UkDcVo3Y23k7Dzhg_ZpibGZ7u3PeomsLiIyYnSRnI735u1EVDpJ9JJ2UQfuLCz2WwxkKbUARbGqhzY-rh_18PIYOyqYw-WEtcZQNtys857792n3JGM75x8k_AEar0ZEug6LphH-GleWfvjPajGTWfUPBNgdRD8oXGnLYuy8dZaWWm2pNANQ4kwYdD1ODxYhu0feP72JR1ij9ssg.tOWt0KdYnk3mx4RjMXokWM2crwK1S8nQMafCIuXuoQs&dib_tag=se&keywords=old+analog+film+cameras&qid=1719215279&sprefix=old+analog+filmcameras%2Caps%2C213&sr=8-55,https://m.media-amazon.com/images/I/61SaNgiFXcL._SX450_.jpg,"<b>Pinhole Exposure:</b> It lets light pass through the pin hole, to hit the film directly, causing exposure without passing through any lens.; <b>Panoramic View:</b> The camera enjoys a super wide panoramic view with the horizontal exposure angle reaching as wide as 120 degree. Aperture: F133.; <b>Film to Use:</b> Accommodate all 120 format films. The use of exposure speed ASA 100 films on sunny days and ASA 400 on cloudy days or indoor occasions is recommended.; <b>Two different Frame Size Masks:</b> one is for 8 frames of 6x9 cm each per roll and another is for 6 frames of 6x12 cm each per roll.; Multiple-Exposures Effect: As the film is advanced manually, the camera can help achieve special effects through multiple exposures by NOT advancing the film after a frame has been exposed. Each depression of the Shutter Release Button will bring about another exposure.","Great light weight camera, easy to use, quirky, and FRAGILE dont drop it. One gripe is that when using a shutter release cable, it only opens the door about 98%, I tried with multiple cables. I made a tiny spacer to make it fully open. Its ok if you dont do this, you just get one side darker than the other around the edge. No issues with the 6x9 mask.; Lomography, altro non vè da dire; The Holga 120WPC is a classic pinhole camera. I gave it 3 stars for image quality, but it’s a pinhole camera and you should expect soft images - definitely NOT digital sharpness. The bubble level and cable release abilities are a step above a Diana F+. You get this camera for the wide image ability. Hopefully they have started to make them again. If not - look for one in the used market and expect to pay a lot more!; The camera is fabulous - exactly what I wanted. But I'm also very impressed by the seller's customer service. One of the frame size masks was missing from my camera, so I wrote to the seller. And within a few days, I received an entirely new camera with both of the frame size masks - no exchange, a whole new camera! So I appreciate that and want to recommend both the cool little crazy camera and the fabulous seller!; So far so good, I’ve developed my first roll, and ended up with some unintended overlapping double exposures. Some things to note to avoid my mistake. The window on the back of the camera is marked with a 16 or a 12. If you want 6x9 negatives, point the arrow at the 16. If you want 6x12 then point the arrow at the 12. Be sure to put the correct insert. Something that isn’t explicitly stated in the directions is this; winding the film to the next number in the window will only move half the frame. You need to wind two numbers, essentially hitting all odd numbers. I realized this once the number 9 showed up in the window. I only got one good frame with no double exposure. That frame was perfectly sharp and totally beautiful. Can’t wait for roll number 2!"
Polaroid Now 2nd Generation I-Type Instant Film Camera - Black & White (9072),"19,542",https://www.amazon.in/Polaroid-Generation-I-Type-Instant-Camera/dp/B0BVPC67N8/ref=sr_1_56?crid=4JBM3GA1T7F5&dib=eyJ2IjoiMSJ9.NO5uvOtYuVMy0p5kpi6Wimx5DLt-UkDcVo3Y23k7Dzhg_ZpibGZ7u3PeomsLiIyYnSRnI735u1EVDpJ9JJ2UQfuLCz2WwxkKbUARbGqhzY-rh_18PIYOyqYw-WEtcZQNtys857792n3JGM75x8k_AEar0ZEug6LphH-GleWfvjPajGTWfUPBNgdRD8oXGnLYuy8dZaWWm2pNANQ4kwYdD1ODxYhu0feP72JR1ij9ssg.tOWt0KdYnk3mx4RjMXokWM2crwK1S8nQMafCIuXuoQs&dib_tag=se&keywords=old+analog+film+cameras&qid=1719215279&sprefix=old+analog+filmcameras%2Caps%2C213&sr=8-56,https://m.media-amazon.com/images/I/71iynYYcHVL._SY450_.jpg,"Polaroid Now 2nd Generation I-Type Instant Film Camera - Black & White (9072); NEW NOW INSTANT CAMERA: Capture and keep your everyday moments forever with the Polaroid Now i-Type Instant Film Camera.; NEW & IMPROVED: Our new Now Generation 2 analog instant camera is now made with 40% recycled materials and the internal lithium-ion battery charges via USB-C; DOUBLE EXPOSURE: The Now camera can frame two moments in one with double exposure, or get yourself in the picture with self-timer and an accurate flash to make everyone look like they should.; POINT. SHOOT. KEEP FOREVER: Now camera is compatible with both i-Type film and 600 film. Film sold seperately.","Utile e carino; Me llegó en el día previsto. La cámara es pequeña y, en mi caso que la compré blanca, simula bien las antiguas cámaras polaroid.
No es una cámara que uses para sacar fotos a tutiplen, sino su principal función es ""Captar momentos"". Y con esos momentos no me refiero a sesiones de fotos como las que se hacen con las canon y demás.
La caja viene con una cuerdita para la muñeca para evitar que se te caiga y un cable que, en mi caso, no servía. He tenido que utilizar el cargador del móvil. También viene con un manual de instrucciones, eso sí, en ingles. Importante decir que no viene con películas para hacer las fotos.
Las fotos salen preciosas si tienes en cuenta todas las instrucciones que te dan, pero un gran contra es el precio: 16€ solamente 8 películas para fotos, siendo 2€ cada foto prácticamente.
Igualmente, yo estoy encantado, porque ofrece un aire vintage que te quedas embobado viéndolo.; Tolle Kamera. Die Filme Kosten zwar ordentlich aber die Qualität ist super. Vor allem haben die Fotos ein schönes Format und sind nicht so winzig wie bei der instax; This is the first time I have owned and used a Polaroid instant camera; this one comes nicely boxed with the camera itself, quick start guide, usb-c cable and a wrist strap. You need film which is sold separately; I got the “Polaroid 6009 Color Film for i-Type” film which is £27.99 for 16 shots/exposures. The cost can add up very quickly being each photo at £1.74 each; however I enjoyed the experience with the physical photos which you don’t get instantly with camera phones and DSLRS. This camera has various features such as self timer and double exposure mode allowing you to get creative.

This camera is compatible with i-Type film and 600 film which are both sold separately; the films do come in various colours and designs on them too. Also you can purchase various accessories for the camera too such as a case.

Finally I enjoyed the experience of testing this camera out; I did find that photos come out over/under exposed or the focus not being sharp. I guess you can’t compare this to a DSLR.; Salen muy oscuras cuando las tomas al interior o exterior"
Lomography Lomo’Instant Camera & Lenses Song’s Palette Instant Film Camera,"27,587",https://www.amazon.in/Lomography-LomoInstant-Camera-Palette-Instant/dp/B0BDCVDQ9N/ref=sr_1_57?crid=4JBM3GA1T7F5&dib=eyJ2IjoiMSJ9.NO5uvOtYuVMy0p5kpi6Wimx5DLt-UkDcVo3Y23k7Dzhg_ZpibGZ7u3PeomsLiIyYnSRnI735u1EVDpJ9JJ2UQfuLCz2WwxkKbUARbGqhzY-rh_18PIYOyqYw-WEtcZQNtys857792n3JGM75x8k_AEar0ZEug6LphH-GleWfvjPajGTWfUPBNgdRD8oXGnLYuy8dZaWWm2pNANQ4kwYdD1ODxYhu0feP72JR1ij9ssg.tOWt0KdYnk3mx4RjMXokWM2crwK1S8nQMafCIuXuoQs&dib_tag=se&keywords=old+analog+film+cameras&qid=1719215279&sprefix=old+analog+filmcameras%2Caps%2C213&sr=8-57,https://m.media-amazon.com/images/I/713Y7gQGOdL._SX355_.jpg,"Fisheye, Portrait and Close-up Lens Attachments; Three shooting modes to cover every kind of instant; Super easy to use with endless experimental features; Built-in flash with colored gel filters included; Compatible with Fujifilm Instax Mini film",
Fujifilm Instax Mini 12 Instant Camera-Pink,"7,499",https://www.amazon.in/sspa/click?ie=UTF8&spc=MToyNTIyOTMyMTYxNjA0MTc1OjE3MTkyMTUyNzk6c3BfbXRmOjIwMTQ3OTIwNzkzMzk4OjowOjo&url=%2FFujifilm-Instax-Mini-Instant-Camera-Pink%2Fdp%2FB0BX8WSXFG%2Fref%3Dsr_1_60_sspa%3Fcrid%3D4JBM3GA1T7F5%26dib%3DeyJ2IjoiMSJ9.NO5uvOtYuVMy0p5kpi6Wimx5DLt-UkDcVo3Y23k7Dzhg_ZpibGZ7u3PeomsLiIyYnSRnI735u1EVDpJ9JJ2UQfuLCz2WwxkKbUARbGqhzY-rh_18PIYOyqYw-WEtcZQNtys857792n3JGM75x8k_AEar0ZEug6LphH-GleWfvjPajGTWfUPBNgdRD8oXGnLYuy8dZaWWm2pNANQ4kwYdD1ODxYhu0feP72JR1ij9ssg.tOWt0KdYnk3mx4RjMXokWM2crwK1S8nQMafCIuXuoQs%26dib_tag%3Dse%26keywords%3Dold%2Banalog%2Bfilm%2Bcameras%26qid%3D1719215279%26sprefix%3Dold%2Banalog%2Bfilmcameras%252Caps%252C213%26sr%3D8-60-spons%26sp_csd%3Dd2lkZ2V0TmFtZT1zcF9tdGY%26psc%3D1,https://m.media-amazon.com/images/I/61+5Ld-oc1L._SY355_.jpg,Take bright photos no matter where and when!; Easy to use for the perfect close-up,"; . .. . . . . .; Good product… but the photos are not very high quality.. this is only for indoor or in sunlight… night phtos are bad; Ordered this for my sisters birthdays as a birthdays gift and she probably loved it so much you can see the quality of picture in the image received the product same as shown in the image love it thank you Amazon ❤
Size is 86mm×54mm; Good 😊; Suggested better not to buy this product mainly from Amazon .....; Got it as a gift for my friend. It clicks on good pictures indoor but outdoor it fails horribly. Also it fails to focus properly more often than not.; Good product; A câmera é linda! As fotos ficam incríveis! O produto chegou antes do prazo!; Amei perfeita dms e linda vem com as pilhas dentro da caixinha.; A câmera é linda e muito boa,funciona cumpri com o que promete nota 10
Adorei!!!!; Muy buen producto, fotos muy bonitas para capturar los grandes instantes en el momento. La única área de oportunidad es que todavía funciona con pilas y que el flash siempre se activa aunque haya buena exposición de luz, si se pudiera activar/desactivar el flash a discreción estaría mejor. Además, la calidad de las fotos está sujeta a la marca de pilas que se usen; se recomienda cambiar las que ya trae incluidas por unas Duracell.; Ela é linda, levinha, bem fácil de usar. Vale super a pena, a única parte ruim é o preço dos filmes mesmo kkkkkkkk (e ainda acabei usando um a toa porque tirei foto do chão sem querer), mas super vale a experiência e o carinho de guardar momentos em fotos reveladas!!!"
"HOLGA 120GCFN Plastic Medium Format Camera Built-in Flash Glass Lens, Black (296120)","11,670",https://www.amazon.in/HOLGA-120GCFN-Plastic-Medium-296120/dp/B07H5QC2YS/ref=sr_1_61?crid=4JBM3GA1T7F5&dib=eyJ2IjoiMSJ9.NO5uvOtYuVMy0p5kpi6Wimx5DLt-UkDcVo3Y23k7Dzhg_ZpibGZ7u3PeomsLiIyYnSRnI735u1EVDpJ9JJ2UQfuLCz2WwxkKbUARbGqhzY-rh_18PIYOyqYw-WEtcZQNtys857792n3JGM75x8k_AEar0ZEug6LphH-GleWfvjPajGTWfUPBNgdRD8oXGnLYuy8dZaWWm2pNANQ4kwYdD1ODxYhu0feP72JR1ij9ssg.tOWt0KdYnk3mx4RjMXokWM2crwK1S8nQMafCIuXuoQs&dib_tag=se&keywords=old+analog+film+cameras&qid=1719215279&sprefix=old+analog+filmcameras%2Caps%2C213&sr=8-61,https://m.media-amazon.com/images/I/41FGVJsjDYL.jpg,"Uses 120 medium format film.2 film masks for either 12- 6x6 cm images or 16- 6x4. 5cm images;Shutter speeds: normal - 1/100S; bulb - Holds shutter Open. Apertures: sunny - f/11; shade/flash - f/8;Built-in flash with Color Filters: white, red, Blue, yellow. Standard tripod mount (1/4-20);Lens cap. Strap;Uses 2 AA batteries (not included)","A wonderful fun camera to capture images with on 120 film. Planning on using this camera in square format! With it`s glass lens images will be crisp and great!; Product came with grime and dirt on it, box been opened and the flash doesn’t work? Little disappointed considering the price…; Arrived in slightly scratched, damaged camera box not very suitable for gift giving.; merci; I regularly shoot 120 film with a Rolleiflex. I bought this hoping for the ""dreamy"" look of a toy camera. My pictures (13 rolls while traveling) turned out much clearer and more ""normal"" than expected.

Two things:
1) WATCH OUT FOR THE BULB SETTING! This can get knocked on very easily. I didn't realize it was, and I don't know how long it was on for. This can result in very overexposed pictures. Tape it to the N position.

2) I feel like an idiot... but be careful with the lens cap. Consider not using one. What you see through the viewfinder is nothing to do with what the camera ""sees"" through the lens. I'm not used to this. So I left the lens cap on several times after ""composing"" my picture. You can't see that it's on there. Finally I threw it out. I had taped up the camera and not having a lens cap didn't produce any light leaks. I kept the camera in my camera bag though."
"Polaroid Go Instant Mini Camera Starter Set, White Instant Camera with 16 Polaroid Go Color Instant Film Bundle, with a Lumintrail Lens Cleaning Cloth","33,658",https://www.amazon.in/Polaroid-Instant-Starter-Lumintrail-Cleaning/dp/B0BDS7BCWC/ref=sr_1_62?crid=4JBM3GA1T7F5&dib=eyJ2IjoiMSJ9.NO5uvOtYuVMy0p5kpi6Wimx5DLt-UkDcVo3Y23k7Dzhg_ZpibGZ7u3PeomsLiIyYnSRnI735u1EVDpJ9JJ2UQfuLCz2WwxkKbUARbGqhzY-rh_18PIYOyqYw-WEtcZQNtys857792n3JGM75x8k_AEar0ZEug6LphH-GleWfvjPajGTWfUPBNgdRD8oXGnLYuy8dZaWWm2pNANQ4kwYdD1ODxYhu0feP72JR1ij9ssg.tOWt0KdYnk3mx4RjMXokWM2crwK1S8nQMafCIuXuoQs&dib_tag=se&keywords=old+analog+film+cameras&qid=1719215279&sprefix=old+analog+filmcameras%2Caps%2C213&sr=8-62,https://m.media-amazon.com/images/I/6140-5zNOKL._SX466_.jpg,"Portable Creativity: The tiniest new member of the Polaroid family is your portable, wearable, partner in creativity.; Self Timer: Find your light with the reflective selfie mirror, and pick your pose with plenty of time, thanks to the self-timer.; Classic Polaroid Film: Classic Polaroid film, but smaller. Take inspiration everywhere, with photos that fit in your pocket.; Double Exposure: Add another layer to your creative vision with the easy-to-use double exposure feature.",Came in on time and it was as described
"Fujifilm Quick Snap Waterproof 27 exp. 35mm Camera 800 film,Blue/Green/white,1 Pack","3,607",https://www.amazon.in/Fujifilm-Quick-Waterproof-Camera-Green/dp/B00004TWM6/ref=sr_1_63?crid=4JBM3GA1T7F5&dib=eyJ2IjoiMSJ9.NO5uvOtYuVMy0p5kpi6Wimx5DLt-UkDcVo3Y23k7Dzhg_ZpibGZ7u3PeomsLiIyYnSRnI735u1EVDpJ9JJ2UQfuLCz2WwxkKbUARbGqhzY-rh_18PIYOyqYw-WEtcZQNtys857792n3JGM75x8k_AEar0ZEug6LphH-GleWfvjPajGTWfUPBNgdRD8oXGnLYuy8dZaWWm2pNANQ4kwYdD1ODxYhu0feP72JR1ij9ssg.tOWt0KdYnk3mx4RjMXokWM2crwK1S8nQMafCIuXuoQs&dib_tag=se&keywords=old+analog+film+cameras&qid=1719215279&sprefix=old+analog+filmcameras%2Caps%2C213&sr=8-63,https://m.media-amazon.com/images/I/71aNofIxThL._SX466_.jpg,FUJIFILM; Original Product,"its a really cheap camera and my gf thought it was like 50$ so pretty gud!; We bought this for our daughter's trip to the Keys. She was going with her school and was only allowed to bring a camera. This was easy for her to use and the pictures came out great. Awesome price too!; Amoooo estás cámaras, este producto escasea mucho en mi ciudad y aunque no es muy barato, la verdad funciona muy bien para tomar fotografías análogas.; Nous l'avons pris quand nous sommes allés faire du canoé. Il est tombé à l'eau, mais pas eu de problème et en plus il flotte. Les photos sont impeccables pour une pellicule. Le plaisir de retrouver des photos en papier mais surtout d'avoir la surprise du résultat car pas possible de connaître la photo avant.; Cumple su función.
Las fotos quedan bien si las sacas de cerca
Muy buena compra,repetiré el próximo verano!!!"
Fujifilm Instax Square Link Smartphone instant Photo Printer - Green,"14,999",https://www.amazon.in/sspa/click?ie=UTF8&spc=MToyNTIyOTMyMTYxNjA0MTc1OjE3MTkyMTUyNzk6c3BfYnRmOjIwMTQ3OTEwOTg0ODk4OjowOjo&url=%2FFujifilm-Instax-Smartphone-Instant-Printer%2Fdp%2FB0BGY6S7WS%2Fref%3Dsr_1_70_sspa%3Fcrid%3D4JBM3GA1T7F5%26dib%3DeyJ2IjoiMSJ9.NO5uvOtYuVMy0p5kpi6Wimx5DLt-UkDcVo3Y23k7Dzhg_ZpibGZ7u3PeomsLiIyYnSRnI735u1EVDpJ9JJ2UQfuLCz2WwxkKbUARbGqhzY-rh_18PIYOyqYw-WEtcZQNtys857792n3JGM75x8k_AEar0ZEug6LphH-GleWfvjPajGTWfUPBNgdRD8oXGnLYuy8dZaWWm2pNANQ4kwYdD1ODxYhu0feP72JR1ij9ssg.tOWt0KdYnk3mx4RjMXokWM2crwK1S8nQMafCIuXuoQs%26dib_tag%3Dse%26keywords%3Dold%2Banalog%2Bfilm%2Bcameras%26qid%3D1719215279%26sprefix%3Dold%2Banalog%2Bfilmcameras%252Caps%252C213%26sr%3D8-70-spons%26sp_csd%3Dd2lkZ2V0TmFtZT1zcF9idGY%26psc%3D1,https://m.media-amazon.com/images/I/41WMMYocVVL._SY550_.jpg,"Create something fascinating with AR doodles, text and more; Share INSTAX SQUARE images with friends from your Smartphone with INSTAX Connect; Enjoy prints with messages even if you live far away.","Its very compact, easy to carry and a handy device to capture your memories; Was not that great; Mejor calidad que la cámara intsx mini; Me encantó, imprime muy rápido y la calidad de impreso excelente; Add film box (yellow corner in yellow corner), install app, start the Instax, connect and start printing.
Easy, fast and colorful. Love it already.; Great gadget, my missus loves it. Very practical for printing and gifting fav photos.; Really good. Prints fine, would have loved a bit sharper images but its polaroid so maybe should not be to picky. Works amazing tho."
"KODAK Mini Shot 2 Retro 4PASS 2-in-1 Instant Camera and Photo Printer (2.1x3.4 inches) + 68 Sheets Gift Bundle, White","15,389",https://www.amazon.in/sspa/click?ie=UTF8&spc=MTo0NTcwODQ0MDc0MjgzMTc1OjE3MTkyMTU0NTI6c3BfYXRmX25leHQ6MzAwMjE2MjAyMjc4MzMyOjowOjo&url=%2FKODAK-Instant-Camera-Printer-2-1x3-4%2Fdp%2FB09B7DH7RV%2Fref%3Dsr_1_65_sspa%3Fcrid%3D4JBM3GA1T7F5%26dib%3DeyJ2IjoiMSJ9.DjP8IoFuESiDNnMx3YYZ1pw4lLycqiSw5KAQmAeKmHIJGHiiDk8YqG8qf3RAuEsTa_WbHgTF50vP9NKH86wM6QuUjb-cGy9jNRo4yKd5wzf2PNVJqTbK-RW_4aomFm6lMUOaLfbSdtnB6YtEULJzzdfzY97BB-gO9zdpfzUrvPJbgg4ncJwIT4i9nSGkTqCw-BY2TgFttaH3nyN6zgU89UwB41grOQCog-naUuF7gz0.5vZQfBqaK59KlB11QoQ_1o_j3mBFzwttl-X8o-Q6-w0%26dib_tag%3Dse%26keywords%3Dold%2Banalog%2Bfilm%2Bcameras%26qid%3D1719215452%26sprefix%3Dold%2Banalog%2Bfilmcameras%252Caps%252C213%26sr%3D8-65-spons%26sp_csd%3Dd2lkZ2V0TmFtZT1zcF9hdGZfbmV4dA%26psc%3D1,https://m.media-amazon.com/images/I/81csu0Xtr9L._SY450_.jpg,"Instant Camera + Photo Printer: The Kodak Mini Shot 2 Retro is a polaroid camera with a built-in photo printer, so you can print your images or cancel them after you have taken them. With this instant cameras, you can also print photos directly from the gallery of your mobile device via Bluetooth. This instant photo camera is compatible with Apple iPhone, iPad & Android devices.; Low Photo Cost: Why pay more to print? Printing has never been easier with our Kodak Mini Shot 2 Retro polaroid camera. Photos are even half the cost if purchased in an instant photo camera bundle! The more you print the more you save with this instant cameras and printer.; Superior Photo Quality: The Kodak Mini Shot 2 Retro polaroid camera utilizes 4PASS technology, which allows you to print flawless photos in just a few seconds. As the photos are printed on layers of color and laminated, they are protected against fingerprints and water. Photos last over a 100 years!; Two Photo Types: It is possible to print both bordered and borderless pictures with the Kodak Mini Shot 3 Retro polaroid camera. With this instant camera, you can create lasting memories by writing down your memories in the border type. You can print the borderless type of photo if you want to have them in a larger size.; Augmented Reality App: Download the KODAK Photo Printer application and print from anywhere at any time. With fun augmented reality features and other decorative features such as beauty, filters, frames, and more, you can use the app to express your photos. Our app and instant photo camera will do the rest of the work for you!","Hi. I liked the product but the cartridge inside the camera was stuck when i took out the first print and hence entire cartridge got ruined. Can u send me a replacement cartridge only?; ; Every thing perfect about this product; DO NOT BUY THIS PRODUCT VERY VERY BAD QUALITY WASTE OF MONEY

++ I have been using instant cameras for a while hence choose Kodak in India as the photo sheets were easily available but that was a mistake

++ pathetic picture quality - I choose two of these kodak cameras as gifts to my nieces and now m so embarrassed as when they clicked pictures ( in day light and night ) I saw the horrible quality product which i got them as gift.

++The product is well build but do not go by pictures on the site its misleading \\

++ I cannot get my money refunded as they do not have return policy - of course why ...since they are selling a bad product; Away from this digital world where we can easily delete the pictures I always wanted a mini Polaroid camera to click and create amazing moments and memories and print instantly... And this camera is something which i loved and wanted from a long time... The compact looks and a good quality instant print adds a lot of value for the money that we spend... Thanks Kodak for making such a wonderful product... Loved using it!; ; Don't get me wrong, this is an amazing device but if you have a phone with a decent camera you should buy the Kodak 4 pass mini printer instead as you'll never end up using the camera aspect of this camera.; As the product is superb in quality of printing pictures, but the camera pixels is very low and the most disappointing thing is its battery backup. I can't print more than 5 photos in one full charge and even the camera is draining the battery when it is not in use; Very important to mention what I've called a quasi instant functionality. Unlike real instant cameras where you can make unintentional clicks and accidental photos (and even when it is intentional - it is not always what you've expected), here you are prevented from that. You are taking the picture, see the intermediate result on a tiny screen and only then you can print it if you want. If not - you can retake it, no film wasted. This is a perfect process for me.

Printing speed is very good (I read some complaints about that and don't get it), quality of the photo is very decent. Of cause, it is not a perfect full scale printing. But what could you expect from such a tiny box? It also adds that old-stile, less-technology, analogue vibe. The lack of internal storage - I think it is a plus. Otherwise, it is just a digital camera, but you already have a way more sophisticated one in your phone. And you can connect it and print from the phone.

We did just one cartridge, but I'me sure we will be shooting a lot on this camera.; This printer is not fast, as it does the four pass print. But the photos come out so good. I also have another brand mini photo printer and the quality of the Kodak is so much better. The only problem I have is the battery drains so fast, like after just a few printings. And the on switch takes several attempts to finally turn on, you have to hold your tongue a certain way I think 🤔. I've had an older models of this printer and never had either of these problems with them. Still, I prefer the prints from this printer over the other brand I have by far. And the app you download to use it is super user friendly and allows for editing, frames, collages and more.; Es una cámara muy buena, la calidad de las fotos dependen mas de la calidad del archivo que de la cámara, su lente es baste bajo o de gama baja te va a ser más útil de impresiona que de cámara en si. Pero si sabes de fotografía te resuelves el problema fácil, en resumen vale mucho la pena en verdad. Es increíble; Taşınabilir baskı makinesi olarak kullanıyorum baskı kalitesi çok iyi telefondan çekip bundan baskı alıyorum kendi kamerası da iyi fakat bazı durumlarda yetersiz kalıyor genel olarak 5/5; Lo bueno es poder imprimiras fotos desde la galería del teléfono móvil a travéz del bluetoot lo malo la calidad de las fotos no es tan buena"
